,title,author,sort,count,status,detail,site,rank1,cover,url1
1075,超越次元的事务所,第三魔法使,二次元,183.4万字,完结,人生之中总免不了遗憾，各类作品也不例外。很多人为之伤心，为之扼腕叹息，也有不少人提起笔，用自己的方法弥补这份遗憾，实现心中的圆满。我则开了一家超越次元的事务所，穿梭在各个世界，与一个个主角配角相遇。倾听他们的愿望，接受他们的委托，用自己的双手和智慧去弥补一份又一份的遗憾，顺带也收取一些报酬。鲁路修求我治好娜娜莉的腿。桐人求我救救优吉欧。宇智波带土想救野原琳。白胡子想救儿子。钢铁侠不想死。JOJO，这个说不过来，因为JOJO不止一个。卫宫巨侠、奥斯本、御坂美琴、宇智波鼬等等。只要有遗憾的地方，就有超次元事务所。只要是最真诚的愿望，就有我们的存在。我是超次元事务所的所长，我是袁满，圆满的袁满。,起点中文网,2.9,https://qidian.qpic.cn/qdbimg/349573/1013636857/300,https://m.qidian.com/book/1013636857/catalog
1076,我有好多复活币,辣酱配咸鱼,二次元,205万字,连载,仙路漫漫，唯剑作伴。我叫江临，是个三好少年。现在嘛......是个魔教中人......哦，还有99999个复活币.......终有一天，她破开了魔教的大门，举剑质问着我。我缓缓地给自己倒了杯茶，淡然道：“爱过......”,起点中文网,3.6,https://qidian.qpic.cn/qdbimg/349573/1017380601/300,https://m.qidian.com/book/1017380601/catalog
1077,海边春意乱，头盖骨当碗,不十分,二次元,41.3万字,连载,"原名：《百年孤独》 [已完本，中短篇，伏笔已收，请放心阅读。] 　曾也是名传统的修仙者，乃至成了人们口中的得道真君。 　　但不知为何，流浪到了这个诡异莫名的世界群落中，我离大道，似乎且行且远。 　　糟糕，遇到了凶险恐怖的异常生物！ 　　没，没关系,反正这次我已经修成了千眼千手有翼无足的幽冥星纹法相，完全不用怂。 　　等一下，这只怪物去掉头........身材似乎还不错啊?",刺猬猫,4.7,https://c1.kuangxiangit.com/uploads/allimg/c180205/05-02-18184830-90895-100059905.jpg,https://www.ciweimao.com/book/100059905
1078,美漫里的龙裔,凌云不渡,二次元,70.9万字,完结,带着《上古卷轴》的游戏系统穿越了美漫世界，成为阿斯嘉德的守卫。刚穿越就遇到了寒霜巨人入侵的必死之局，特斯卡心想：“还好我玩游戏爱作弊！”新书:《为师有个新任务》已发，求收藏求推荐！,起点中文网,3.9,https://qidian.qpic.cn/qdbimg/349573/1013921027/300,http://book.qidian.com/info/1013921027
1079,获得幸福的方法,月鸦,二次元,12.5万字,完结,当我发现自己的人生，忽然如轻小说一样烂俗……,刺猬猫,7.4,https://c1.kuangxiangit.com/uploads/allimg/c160907/07-09-16070212-24304.jpg,https://www.ciweimao.com/book/100018407
1080,火影之明镜止水,沉默的神风,二次元,38万字,连载,汝等渴求之物……汝等憧憬之人……终究不过是镜中繁花，水中明月，幻变无定。这场忍者物语的拙劣傀儡戏终将落幕，但最终的结局，却非幕后之人可以决定。那徘徊于时间夹缝中的大筒木亡灵，再也不能左右世界的命运，一切都将被时间掩埋……,起点中文网,6.3,https://qidian.qpic.cn/qdbimg/349573/2222956/300,http://book.qidian.com/info/2222956
1081,精灵的恋爱物语,祈灵,二次元,72.1万字,完结,简简单单的正经玛丽苏日常，大概。 女主文，百合，不喜误入。,刺猬猫,2.1,https://novel-cdn.kuangxiangit.com/uploads/allimg/c180515/15-05-18100646-70232-100057118.jpg,https://www.ciweimao.com/book/100057118
1082,姐姐总是被穿越,但慰青帝,二次元,73.3万字,连载,姬灵曦推开房门，就看到姐姐坐在床榻上：“遵从召唤而来，你就是我的……” “我不是你的舰长、提督、马斯特、指挥官、营养师！更没有召唤你，请你快滚！不然打死！” 对姬灵曦来说，这世上没有什么事，比姐姐总是被穿越更糟心了，这些自称【科学与魔法的最终人形热兵器】的穿越者把他的生活搞得一团糟，每个月购买钢铝油弹金棋子银棋子熔火核心等乱七八糟的东西就要花一大笔钱，但如果只是这样也就算了…… 什么？你们世界的女人露个后背大腿小蛮腰都不算伤风败俗的？ 什么？你们世界的舰娘战斗的时候，要把舰装的神经连接装置放在oo里？ 什么？你们世界的英灵必须要和马斯达补魔，才能发挥百分百的战斗力？ 娘希匹哦！我们的世界是正经的仙侠世界啊！快给我滚回去！ 姐姐总是被穿越，我能怎么办？我也很绝望啊！,刺猬猫,5.6,https://c1.kuangxiangit.com/uploads/allimg/c170514/14-05-17235526-14767-100033839.jpg,https://www.ciweimao.com/book/100033839
1083,我，太子，让位！,繁华落寞之时,二次元,17.9万字,连载,【神脑洞系列--原创征文】 我只想做一个混吃等死的宅 但谁想我竟然会穿越到这混乱的皇城中 最要命的是，我貌似还是个太子？ 而且以后继承皇位的几率还很大？！ 这怎么行，比起做一个诸事缠身，稍不留神就会被人害死的顶级靶子，我还不如做一个天天遛狗斗鸟的闲（咸）王。 “二弟！大哥觉得你天赋异禀，定是个做皇帝的好料子，何不……” “大哥！小弟今日稍感不适，您还是和三弟谈论吧，以后莫要说这种伤和气的话了” “哈？二哥！你说什么？我听不见，最近打仗打的我耳朵受了点伤，你还是找四弟吧” “三哥！再说这种话我可就和你割袍断义了！当皇帝的人必须要有心怀天下的能力，我可没这本领，您还是找五弟吧” …… “你们这群逆子！”吹胡子瞪眼的怒拍着桌子，伟大的皇帝殿下看着面前争吵不断的儿子们，用充满杀意的眼神望着被捆成粽子样的太子，语气无比的悲恸“你到底和你的弟弟们说了什么？朕打下的大好大好江山你们为何就不想继承呢？！”,刺猬猫,5.6,https://novel-cdn.kuangxiangit.com/uploads/allimg/c171114/14-11-17205809-84270-100047018.jpg,https://www.ciweimao.com/book/100047018
1084,我的火影忍者,卢碧,二次元,78.5万字,完结,博人传博人：我爸是火影，我爷爷是火影，我爷爷师父的老师是火影，我爸师父的老婆是火影，我爸师父的老婆她祖父和叔公都是火影，我爸的老师也是火影，我全家都是火影！鹿代：我们能不说火影吗？博人：六道仙人是我哥鹿代：...我们还是说说火影吧博人：我全家都是火影！鹿代：……这是一个小时候不小心解开了封印，导致九尾当爸，水门当妈的鸣人的故事。企鹅群：223685218新书已经发布，书名：为美好的异世献上科学，欢迎品尝,起点中文网,4.1,https://qidian.qpic.cn/qdbimg/349573/1004157721/300,https://m.qidian.com/book/1004157721/catalog
1085,木叶之残火太刀,崖边小憩,二次元,100.1万字,完结,穿越到火影，开局一把刀。看着可能成为自己妹夫的宇智波鼬，佑介一边磨刀一边笑道：“泉美和佐助掉进河里，你先救谁？”宇智波鼬：“......”,起点中文网,4.1,https://qidian.qpic.cn/qdbimg/349573/1022335330/300,https://m.qidian.com/book/1022335330/catalog
1086,我在东瀛当社畜,淡蓝色,二次元,113.7万字,完结,具有女性恐惧症的黑崎业在成为社畜的某天上班途中被巨.乳美女高中生胸前突然蹦出的纽扣给击昏后……,刺猬猫,5.1,https://c1.kuangxiangit.com/uploads/allimg/c180121/21-01-18161122-53073.jpg,https://www.ciweimao.com/book/100058571
1087,我是高手我说了算,放开那只女王,二次元,170.2万字,连载,无限流 世界进程：前三卷原创——第四卷型月神代——第五卷苍蓝钢铁——第六卷少契联动——第七卷圣杯战争（爱傲天传说）——第八卷影之国（紧身衣BBA）——第九卷弑神者——第十卷诸神黄昏——第十一卷梦回法兰西——第十二卷伊莉雅——第十三卷型月尾声——第十四卷死神来了二次元版……,刺猬猫,3.3,https://novel-cdn.kuangxiangit.com/uploads/allimg/c180404/04-04-18012829-60256-100029052.jpg,https://www.ciweimao.com/book/100029052
1088,我的前女友是大明星,可乐,二次元,100万字,完结,本书又名《我的白色相簿》、《我没道理被菜刀》、《我不是渣男》、《我是无辜的》等等。隔壁邻居跟我们家是百年死对头，但我却跟他们家的大明星女儿秘密交往了七年...,起点中文网,3.3,https://qidian.qpic.cn/qdbimg/349573/1016664522/300,https://m.qidian.com/book/1016664522/catalog
1089,新番进行時,因果,二次元,290万字,完结,时空穿梭、因果悖论、克隆复制、宿命循环…… 第一卷：剑姬神圣谭 第二卷：Re：creators 第三卷：fate/apocrypha 第四卷：Overlord 第五卷：东京食尸鬼 书群：489272872,刺猬猫,3.5,https://c1.kuangxiangit.com/uploads/allimg/c180730/30-07-18194658-41498-100035200.jpg,https://www.ciweimao.com/book/100035200
1090,如此平凡的我也想要得到认可,此刻光华,二次元,80.9万字,完结,我生来就是个平凡的家伙。 没有什么受欢迎的品质，也没有什么惊艳的才能。 是名副其实的“路人”属性的角色。 可是，即使是这样的我，也会渴望，有谁能够认可我。 哪怕只是认可...我的努力。,刺猬猫,6.0,https://c1.kuangxiangit.com/uploads/allimg/c200418/18-04-20004206-38806-100159912.jpg,https://www.ciweimao.com/book/100159912
1091,一剑斩破千法之书,拿狼跳狼,二次元,30万字,连载,女武神不懂云中剑仙的超凡绝尘 仙朝女皇不懂精灵女王的恢弘浩瀚 通灵女巫不懂巫山神女的缥缈莫测 魔门元君不懂血族女王的奇魅无邪 ……,刺猬猫,5.2,https://novel-cdn.kuangxiangit.com/uploads/allimg/c200107/07-01-20230054-25133-100142135.jpg,https://www.ciweimao.com/book/100142135
1092,我的妹妹怎么可能是问题少女！,你家大大爱吃石榴,二次元,41.3万字,完结,「最后一卷简介」 我知道，我与妹妹相处的时间不多了，这个假期过后，和妹妹分离的事情仿佛已经注定了，回到奶奶家，我想用这个新年，好好陪陪妹妹，这个长满我和妹妹回忆的地方，也许有什么东西，值得我们去保护。 当初的故事，神庙的祈愿，一点一点火光下，是接连而来的麻烦，分裂的感情，还有不可阻挡的心意。 但有些东西真的是无法否定的，我想永远保护妹妹的心意。当两个缠绕了五年的心靠近，到底会怎么样？ 我只知道，妹妹永远是哥哥的天使。 —— 欢迎加入我的妹妹是问题少女！群号码：398340812,轻文轻小说,8.7,https://image.iqing.in//cover/055487c8-4203-4a6d-85e3-81c120183db1.jpg,http://www.iqing.com/book/7883
1093,综漫里的警官,少年先疯队队长,二次元,131.8万字,完结,年轻的警官家里有着妹妹春日野穹，外面却又领养了一个妹妹立华奏，身为高级警官司机竟然是笨手笨脚还路痴的艾拉，莫名其妙的与黑社会老大女儿，一名标准的不良少女成了朋友。 人物还包括了见崎鸣和NEET侦探爱丽丝（紫苑寺有子）以及最新添加的声之形的西宫硝子，本书没有异能，主体以日常为主。,刺猬猫,4.1,https://c1.kuangxiangit.com/uploads/allimg/c180214/14-02-18132923-41487-100033035.jpg,https://www.ciweimao.com/book/100033035
1094,封印指定,李宅大人,二次元,44万字,完结,就我所言，人类的世界充满了阴影，影子里随时可能伸出的手臂将你拖入黑暗。 城市林立的高楼就像是祭奠已逝之人的墓碑一般，冰冷，生硬。 人间是孤岛。 周围其黑色的海水，但那真的是海水吗？海水的下面游荡着的又会是什么怪物？ 原来…… 是…… 一篇披着克苏鲁外壳的日常文。 …… （说海绵宝宝和派大星的你们够了哈…—，—） 另外，本书时间线是经过魔改的，究竟处于第几世纪你们看着来就行。 点一下，看一年，收藏不花一分钱！看到就是赚到！我是李道年，是兄弟，就来《封印指定》砍我吧！ 新书书名《诺亚的贤者时间》 书友群群号：612053861,刺猬猫,4.6,https://c1.kuangxiangit.com/uploads/allimg/c180121/21-01-18202356-49368-100055326.jpg,https://www.ciweimao.com/book/100055326
1095,龙珠之牧神传说,枫叶缀,二次元,175.2万字,完结,穿越来到龙珠世界，这是一个充满热血与冒险的世界。同时，这也是一个充满危险的世界。牧阳一不小心，让敌人没了活路。“基纽队长，咱们逃跑吧，我们不是那个人的对手！”吉斯神色慌乱地向后退。“弗利萨大王，那个恶魔又追上来了。”“我们的总部星球被对方摧毁了。”“混蛋，该死的家伙，我们到底什么仇什么怨，竟然敢一而再再而三的戏弄本王！”弗利萨双目欲裂，愤怒正淹没他的理智。已完结《龙珠之最强神话》群号：12326692,起点中文网,5.0,https://qidian.qpic.cn/qdbimg/349573/1012848452/300,http://book.qidian.com/info/1012848452
1096,时崎狂三的位面之旅,礼祐,二次元,252.1万字,完结,主神空间被摧毁时，获得一丝轮回者真灵的时崎狂三，开启了新的旅程。学园默示录→末世之黑暗召唤师→漫威宇宙→Fate/Zero→斗破苍穹→末黑·续（内含多个小世界，包括噬血狂袭→Re：从零开始的异世界生活→不死者之王「OVERLORD」）→吞噬星空→约会大作战......Ps.老群暂时无法进入，新群：894046310，暗号：阿霁。,起点中文网,5.0,https://qidian.qpic.cn/qdbimg/349573/1010046641/300,https://m.qidian.com/book/1010046641/catalog
1097,我真不想救人了,酵姆,二次元,108.3万字,完结,这是一个被诅咒的蒸汽朋克世界，这里充满着诡异猎奇的魔兽，难以置信的怪人，游戏博弈的交织。主角一刀一扇，行在乱世之中，杀伐决断，且看如何诛灭隐藏在冥冥之中盘玩世界的克苏鲁魔神，成为绝世强者。,起点中文网,5.0,https://qidian.qpic.cn/qdbimg/349573/1017007942/300,https://m.qidian.com/book/1017007942/catalog
1098,魔王不必被打倒,如倾如诉,二次元,239.9万字,连载,————【圣剑】。————【技能】。————【祝福】。作为被召唤到异世界的勇者，该开的挂，希恩就基本都开遍了。而他的任务也只有一个，那就是响应女神的愿望，打倒魔王。可是......“魔王并不一定得被打倒吧？”勇者的脑海里就瞬间闪过几百个G的画面。“嗯，这才是打倒魔王的正确姿势。”群号：1104051839（内有VIP群号，如想入群，可前往了解）（PS：已完本四本500万字以上长篇小说《少女大召唤》、《全方位幻想》、《直死无限》、《奇迹的召唤师》，更新有节操，各位书友可以放心食用。）,起点中文网,2.6,https://qidian.qpic.cn/qdbimg/349573/1021905291/300,http://book.qidian.com/info/1021905291
1099,我的前世大有问题,千杯不念,二次元,102.3万字,完结,新书《开局继承神魔墓场》正在连载，欢迎品尝！身为高中生的宁夜，某日遭遇了人生最大的惊喜，喜当爹了！一只萌萌哒的小女孩，突然冲过来抱住他的大腿，眼泪汪汪地道：“爸爸，终于找到你了！”自此，他的人生进入了无限崩坏模式——普群：533427458（无门槛）,起点中文网,5.4,https://qidian.qpic.cn/qdbimg/349573/1010822580/300,http://book.qidian.com/info/1010822580
1100,我成了宇智波族长,北风狠狠吹,二次元,167.1万字,完结,宇智波富岳对眼前的宇智波鼬说道：“宇智波是木叶第一大家族，不需要政变也能掌权。”,起点中文网,5.3,https://qidian.qpic.cn/qdbimg/349573/1015480221/300,https://m.qidian.com/book/1015480221/catalog
1101,宅童话,话中鱼,二次元,117.8万字,连载,小女孩对着微弱的火光露出了微笑；狼耳少女看着远方提起了手斧；冰晶的城堡里女王的思恋化为风雪;辽阔的大海中公主的恋歌掀起巨浪；女巫在狂笑，妖精在歌舞，巨人低下头颅，神灵停下脚步。..........亡国的阴影里王子脸上的笑容逐渐凝固。ps：不推主义，要看推土机的可以绕路了。,起点中文网,4.3,https://qidian.qpic.cn/qdbimg/349573/1015869593/300,http://book.qidian.com/info/1015869593
1102,精灵聊天群,传语者,二次元,24.5万字,完结,“久我景明同学，请和我交往吧！！”“抱歉，你不在我的——”“没事！！我知道你喜欢它，我们可以一起！！”“嗯？！”这是一本十分正经的文，请相信作者的节操！！聊天群绝不是某某软件！！PS：已有百万连载老书。关键词①：神奇宝贝，宠物小精灵，口袋妖怪，宝可梦。关键词②：写实，宠流，蛋生，慢热。PS：从零开始的科普文，不了解者也不影响阅读。,起点中文网,5.6,https://qidian.qpic.cn/qdbimg/349573/1013476177/300,http://book.qidian.com/info/1013476177
1103,有四十八件帝具的我却只想靠自己,好命的猫,二次元,110.7万字,连载,我叫凌泽，是个瞎子，人在斩赤，有四十八件帝具，能穿越世界。点到为止，简介无力，正文再见。综漫无限流：《斩！赤红之瞳·零》→《浪客剑心·追忆篇》→《斩！赤红之瞳·零》贰→《钢之炼金术师FA》→《斩！赤红之瞳·零》终→《Fate/staynightUBW》新书《千万别惹约德尔人》，LOL同人，请大家多多支持~裙号：451984587老猫的猫窝（书友群）,起点中文网,5.5,https://qidian.qpic.cn/qdbimg/349573/1022051721/300,http://book.qidian.com/info/1022051721
1104,漫威之致命守护者,青圭大大,二次元,81.7万字,完结,一个来自平行宇宙的人，一个来自平行宇宙的共生体。当二者在这漫威宇宙相遇，会掀起怎样的波澜？超级英雄or超级反派？龙尼与毒液，正义与邪恶。观念的碰撞终将使这个特殊的个体走上一条绝无仅有的道路。龙尼/毒液：“我是一个致命的守护者。”p.s1：书友群七八七九零九三五七。p.s2：有一部分剧情是DC海王，其他的都是漫威。如果不想看的，可以跳过，不影响阅读。新书《诸天模板》已经发布，有兴趣的可以去看看,起点中文网,4.0,https://qidian.qpic.cn/qdbimg/349573/1013557279/300,https://m.qidian.com/book/1013557279/catalog
1105,木叶有妖气,威馆长,二次元,122.8万字,完结,终结谷之夜伴随金色流星从天而降的星落临也，被千手扉间收养。本来以为是火影世界，自己带着金手指问题不大的时候，结果却发现这世界居然有妖怪！妖怪就算了，请问你们伊贺、甲贺忍者也穿越了？还有风之国的嵌合蚁军团是什么鬼？土之国拳王霸主拉奥列土封疆了？这块杀生石是哪来的？四魂之玉碎片？凭依果？完了完了，这个世界怕是等不到斑爷搞事了……书友扣扣群:632291742,起点中文网,4.1,https://qidian.qpic.cn/qdbimg/349573/1014929926/300,http://book.qidian.com/info/1014929926
1106,叛逆的笼中鸟,夏日初雨,二次元,22.7万字,连载,笼中的鸟儿，渴望着自由。来自异世的灵魂让忍者的世界驶向未知的彼岸。（火影同人，木叶、日向分家开局）,起点中文网,4.8,https://qidian.qpic.cn/qdbimg/349573/1015398202/300,https://m.qidian.com/book/1015398202/catalog
1107,拉倒吧，朕的大秦都完了讲这些有啥用,猎猎狂风,二次元,114.7万字,连载,穿越这件事…很好理解…… 穿越成秦二世胡亥…嘛，穿越者总是需要点挑战的…… 这个世界能修炼…罢了，也算勉强能接受…… 恩，我是个修炼废柴？淦，你以为这种废柴流开局还唬得到我？ 但是，能否解释一下眼前弯腰的李斯胸口那幽深的沟壑是什么回事…… 还有旁边那个小受竟然是赵高？这到底是个什么鬼世界啊啊啊啊啊！ ---------------- 群名【大秦子民都很帅】，群号是【601426416】，进群问题是【挤牙膏从哪挤才对】，答案是【挤个几把】,刺猬猫,3.6,https://c1.kuangxiangit.com/uploads/allimg/c161210/10-12-16225039-60666.jpg,https://www.ciweimao.com/book/100023156
1108,在名侦探世界当死神,仙舟,二次元,59.7万字,完结,咸鱼死神白树前往小世界刷业绩时，发现这里简直是死神的天堂。因为落地第一天，他就见到了一个名叫工藤新一的男人。这个走到哪让人死到哪，明明连鬼都看不见，却被无数地球人封为“死神”的男人蹲下身，打量着地上的白树，眉头紧皱，自言自语，“错不了，这一定是他杀。”白树：“……”趁工藤新一跑去报警，死神伸手捞过自己的头，往脖子上一安，飞速逃离现场。洗干净坐在家里沉思片刻，白树拨通了一个电话，“毛利侦探您好，久仰大名，缺徒弟吗？”掐指一算，工藤新一马上就要变成柯南。只要混进这个小学生的死神领域，他就可以过上躺着数业绩的日子了！,起点中文网,4.1,https://qidian.qpic.cn/qdbimg/349573/1013661513/300,http://book.qidian.com/info/1013661513
1109,人渣女主的养成方法,长触手的咸鱼,二次元,194.1万字,完结,为什么会变成这样啊，第一次穿越到了二次元，见到了一直想要见的圣人惠，两份快乐的事情重合在一起，而这两份快乐，又给我带来更多的快乐，得到的，本该是梦境一般的幸福时间···但是为什么，为什么我会变成高中生版的皆川茜啊！？ 这些也就算了，那么谁能告诉我为什么加藤惠为什么会是重生者啊，英梨梨身上的系统又是怎么回事啊，还有诗羽学姐，不管怎么看都有种不正常的感觉啊！,刺猬猫,5.8,https://c1.kuangxiangit.com/uploads/allimg/c170822/22-08-17171748-78686-100033896.jpg,https://www.ciweimao.com/book/100033896
1110,没人比我更懂骨气,爱开小差,二次元,54.6万字,完结,面对平冢静的质问。 　　    在办公室里的北原信睿把他的梦想平静地说了出来。 　　  “我要成为全世界最优秀的男人，漫画家、偶像、轻小说大师，什么我都要做到最强，然后，把自己的身价抬到最高，当一个平平无奇的上门女婿。” （简介不行，个人建议先看四十章） .................. 混合综漫——偏冷门日常世界观有【我是大哥大】、【碧蓝之海】等。 （大部分综漫男主角不会出场。） （后宫文。）,刺猬猫,5.2,https://c1.kuangxiangit.com/uploads/allimg/c200602/02-06-20174409-78343-100174632.jpg,https://www.ciweimao.com/book/100174632
1111,我，桑松家的穿越者,流浪的盖亚,二次元,40.5万字,连载,转生到了古老异世界的夏尔看着眼前的P社系统，原本想安安静静的过完这辈子的他知道了自己已经走在了大奸大恶的，恶名从黑森到古帝国无人不知无人不晓的康庄大道上了。（咳咳，盖亚是周更的，提示一下） Q群：530206415,刺猬猫,5.5,https://c1.kuangxiangit.com/uploads/allimg/c191224/24-12-19194554-8563-100063235.jpg,https://www.ciweimao.com/book/100063235
1112,我不想被攻略啊,长触手的咸鱼,二次元,206.6万字,连载,我真不想被攻略。,刺猬猫,6.6,https://novel-cdn.kuangxiangit.com/uploads/allimg/c190327/27-03-19110754-65806-100058025.jpg,https://www.ciweimao.com/book/100058025
1113,绅士的自我修养,猩红沙漠,二次元,32.3万字,连载,本书又名：《Ｈ狗的自我修养》《养妹狂魔》群：647442618 穿越到二次元里，最想干的是什么？当然是解放自我啊！ 人活着就是为了萝莉！为了欧派！为了白丝！ 不搞事对得起卡密萨马？ 要布满他对二次元的爱。 春日野穹：诚的第一次是属于我的！ 白：等我十六岁就让尼的童真毕业！ 霞之丘诗羽：人渣君就是传说中的养妹狂魔吗？ 宫园薰：明明他不是演奏家，我却感觉到我和他能演奏出更美妙的旋律。 椎名真白：笨蛋快脱衣服。 夏川真凉：请多指教，冒牌男友桑。 高板桐乃：变态！你才是真正的萝莉控！ 神崎兰子：制作人先生被黑暗吞噬吧~ 西木野真姬：纳尼所列，一米挖干奶。 薙切绘里奈：你能满足我的神之舌吗？,刺猬猫,7.3,https://c1.kuangxiangit.com/uploads/allimg/c171202/02-12-17225921-88638-100049223.jpg,https://www.ciweimao.com/book/100049223
