,title,author,sort,count,status,detail,site,rank1,cover,url1
747,船长的次元开拓手记,三人塔,二次元,145万字,完结,【2017神脑洞系列征文第二期参赛作品】 辛苦十几年首付买船即将踏上人生巅峰的利斯特先生不幸穿越了 “所以，这就是你拐骗无知少女上船的理由？” “这是雇佣！我好好给她们开工资了！” “这些话在局子里再说吧。” 新大陆的开拓者不小心变成了新次元的开拓者，要怎样做才能装作自己经常穿越的样子，在线等挺急的！,刺猬猫,6.9,https://c1.kuangxiangit.com/uploads/allimg/c171202/02-12-17231351-47692-100029128.jpg,https://www.ciweimao.com/book/100029128
748,宅厨师,话中鱼,二次元,187.3万字,连载,白夜穿越到了一个很奇葩的以食为天的异世界成为了一个厨师，本以为依旧是平凡的过完一生，但他慢慢的发现这个世界怎么老是有些奇怪的东西乱入啊。美食细胞是什么鬼?远月学院又是怎么回事?传说中的厨具到底是真是假?就连刀剑神域美食猎人版都出来了你到底想要闹哪样……ps:但走心走胃不走肾，想看人形推土机的可以绕道了。虽然感觉也没几个人看，但是还是建了个书友群，欢迎加入宅厨师，群号码：553438462,起点中文网,4.5,https://qidian.qpic.cn/qdbimg/349573/1004357330/300,https://m.qidian.com/book/1004357330/catalog
749,就算是伪娘也推给你看,柳子卿,二次元,65.4万字,完结,这是一个弯掉了的美貌少年在搞基的路途中被一群妹子强行掰直的故事。 PS1：书名，各种意义上是对本文的最好诠释~~ PS2：大概微毒，大概微羞耻，大概微腐~ PS3：这是小众邪典文，接受不能的请不要好奇，谢谢 群：483136259,刺猬猫,6.1,https://novel-cdn.kuangxiangit.com/uploads/allimg/c170629/29-06-17121716-33863-100003201.jpg,https://www.ciweimao.com/book/100003201
750,为这美好的世界献上勇者！,夜半葵,二次元,116.1万字,完结,因某种难以启齿的原因而被传送到冒险者大陆的勇者大人，在异界开始了没羞没臊的、不可描述的生活。 少女、欧派和荷尔蒙，就是冒险的要义。,刺猬猫,4.9,https://c1.kuangxiangit.com/uploads/allimg/c170630/30-06-17170701-16643-100030365.jpg,https://www.ciweimao.com/book/100030365
751,我只想好好谈恋爱,平生欢,二次元,45.4万字,连载,（本书主角非舔狗，女主非绿茶，标题党，请慎重。） 古桥照月只想好好谈个恋爱，怎么就那么难呢。 …… …… 全新故事，全新感觉；社会主义作者，从我做起！,刺猬猫,5.4,https://novel-cdn.kuangxiangit.com/uploads/allimg/c191113/13-11-19181804-44108-100133047.jpg,https://www.ciweimao.com/book/100133047
752,天津祸土,接口卡,二次元,6.4万字,连载,少女全新的生命。,刺猬猫,5.4,https://c1.kuangxiangit.com/uploads/defaultimg/c200827/27-08-20151831-75910.jpg,https://www.ciweimao.com/book/100185706
753,无惨我老婆,老狗,二次元,33.8万字,连载,穿越日本当天得老婆？ 而且还是个绝世无双的大美女，李奇很是满意了。 但就是不知道为什么，老婆总是在晚上出门，白天不愿意出门。 不过这也没关系，就是李奇穿越自带的系统每天都在刷新： 【宿主存活一天，获得成就‘凡人不死于BOSS’，奖励：大师级医术】 【宿主存活二天，获得成就‘你比主角还要强大’，奖励：大师级剑术】 这真是莫名其妙。 更莫名其妙的是，有一天和老婆上街，一个长得挺和善的穿着黑绿大褂的小兄弟，在街上怒吼着：鬼舞辻无惨，我绝不会放过你的！ 真是个可怜的少年，肯定遭了很多罪吧。,刺猬猫,5.6,https://c1.kuangxiangit.com/uploads/allimg/c191015/15-10-19140836-83963.jpg,https://www.ciweimao.com/book/100130731
754,公主叛国记,甜腻的幸子酱,二次元,92.9万字,完结,这个世界处于战乱之中，有异能，有坦克娘，还有永生种。 按理说这里应该是个适合穿越成指挥官，开金手指收后宫顺便统一世界的好去处。 可是……为什么对我来说，这个世界……那么丧病呢？ 看完后没被虐哭请在书评区辱骂作者，如果被虐哭了，请推荐给和你有同样癖好的抖M 本书原本是鲁鲁修同人文。因为不知道为何每次安利时总被人以同人文不看的理由拒绝，故去了一次同人化。没有看过鲁鲁修并不影响正文阅读,刺猬猫,6.1,https://c1.kuangxiangit.com/uploads/allimg/c190711/11-07-19104357-12148-100009026.jpg,https://www.ciweimao.com/book/100009026
755,我是电竞女主播,折小仙,二次元,102.4万字,连载,成为一个顶尖的电竞女主播需要什么？ 倾国倾城的美貌？ 舌灿莲花的口才？ 出神入化的技术？ …… 不，你只需要和一个妹子交换身体。 （本作中涉及的网站、公司、团体、主播、职业选手等皆为虚构，请勿对号入座。） 群号595480914，欢迎来互动。,刺猬猫,5.9,https://c1.kuangxiangit.com/uploads/allimg/c170222/22-02-17110800-84640-100021266.jpg,https://www.ciweimao.com/book/100021266
756,房东带伞不带刀,江舞,二次元,54.1万字,连载,当个小房东，看人间百态。 yy的青春，大家笑一笑就好。,刺猬猫,4.2,https://c1.kuangxiangit.com/uploads/allimg/c200613/13-06-20000015-99820.jpg,https://www.ciweimao.com/book/100178922
757,刚穿越就秃了的我在异界寻找生发办法,痴痴的书呆子,二次元,115.3万字,完结,（本作背景为魔改中古战锤，设定有一定区别，请战锤粉冷静的往下看，当然，不懂战锤也不影响阅读。） 血祭血神，颅献颅座！ 从极北之地再度刮起的刺骨咧风之中，混杂着黑暗生物的嘶吼与混沌仆从的高呼，他们将再度掀起血腥与杀戮的战争以取悦他们的神明。 毫无疑问，秩序文明正在面临巨大的威胁，抵御混沌需要他们竭尽全力，但四周的恶邻却又不得不防，这是一个强者勉力求生，弱者不如去死，非为利而战，因不战便死的世界，只是这和只想重新长出头发的主角有什么关系呢？ 主角：请问…… 斯卡文鼠人：没有！没有！次元石只能让人掉头发！掉头发！ 吸血鬼：我们领袖都还是光头！曼弗雷德：你看你看，就差因为皮肤太差不能反光了。 黑暗精灵：我们的领袖脑袋没有毛，全身都没有毛！巫王马雷基斯：“……” 绿皮：俺寻思你要不要试试这个史古格？ 混沌：老大别关传送门，我们还没进去！ “滚！那秃子来了！”（邪神嘶吼）,刺猬猫,6.3,https://c1.kuangxiangit.com/uploads/allimg/c180816/16-08-18142717-90241.jpg,https://www.ciweimao.com/book/100077660
758,我的室友是美少女,暴走推土机,二次元,91.3万字,完结,“我的室友突然从一个抠脚大汉变成了身娇体柔的妙龄少女，我该怎么办，急，在线等。” “长得如何？” “呃，是个36D童颜巨R的美少女。” “废什么话，赶紧上她呀。” ----- 又名《我的基友不可能这么可爱》，《我的室友是36D》，《和美少女的同居生活》，《我的神大人绝不会这么坑》。 总之这是一本弘扬正能量，宣传德智体美劳的小说。 群号：417371802。50月票加一章。,刺猬猫,6.0,https://novel-cdn.kuangxiangit.com/uploads/allimg/c160308/08-03-16210456-64603-100002195.jpg,https://www.ciweimao.com/book/100002195
759,所有人都想攻略我,单曲循环,二次元,86.1万字,连载,卫瑶光从男生变成了貌美优雅气质佳的女孩子，仰慕者连起来能绕地球好几圈，就连家境都是举世无双的优越。 但有一天，她突然发现自己所处的世界是Galgame那样的攻略游戏世界，而自己则是那个所有人都想攻略的女主角。 面对一群费尽心机想刷自己好感度的心机婊，卫瑶光表示：“呵呵。” PS：还有，本文变百的说✧٩(ˊωˋ*)و✧ （群号：362377655）,刺猬猫,5.9,https://c1.kuangxiangit.com/uploads/allimg/c160914/14-09-16012509-57356-100017691.jpg,https://www.ciweimao.com/book/100017691
760,这个成就有毒！,河流,二次元,135.4万字,完结,提问：有一个智障女主是怎么样的体验？ 匿名回答：比一般人想象得要舒服。智障欢乐多，让你的生活不会枯燥无趣，而且和她在一起你无时无刻都可以感到智商上的优越感。 也能锻炼你自力更生的能力，毕竟你不能指望智障帮上忙。唯一的问题就是你时不时会问自己——我留着这个智障的意义是什么？ 追问：在【有一个废物金手指是怎么样的体验】里有一个回答和你这个很像。 匿名回答：嗯。那个也是我写的。 ………… 提问：有一个毒舌腹黑男主是怎么样的体验？ 爱莲娜：他今天嘴上骂了我七次智障，在心里骂了我七千四百六十八次……人家才不是智障啊！ . . . ps：怠惰河的读者群，群号码：478464371,刺猬猫,5.2,https://c1.kuangxiangit.com/uploads/allimg/c161210/10-12-16163854-60188.jpg,https://www.ciweimao.com/book/100023137
761,命运夜之猫咪游戏,纯天然的星星,二次元,112.3万字,完结,【欢乐书客暑期主题征文】 病娇少女间的百合恋爱。 爱尔温：“清姬，你爱上别的Master了呢。说好的爱我呢？说好的不撒谎呢？” 清姬：“噫！Master（咕哒子）也是安珍大人啦！所以才不是花心，真的不是！” 咕哒子：“我不管！我要吸爱喵啦！” 贵圈真乱的病娇百合味的Fate，希望大家喜欢。 本书纯百，不喜勿入~~~,刺猬猫,7.4,https://c1.kuangxiangit.com/uploads/allimg/c170903/03-09-17184744-91416-100039838.jpg,https://www.ciweimao.com/book/100039838
762,我渡了999次天劫,蓝白的天,二次元,60.7万字,完结,穿越神州大地的甄河图，看什么都带游戏说明栏。什么都不看先看自己属性——机缘９９！妥了，河图觉得自己定然是天命之子，地上捡个桃子都是天上掉下来的蟠桃！不用修炼，吃米饭十几年也能吃成个大罗金仙，人间老怪什么的。直到二十年后，看到自己的境界数据【练气期（8585520/？？？？）】，还有头顶酝酿的第９９９次紫雷天劫，他不禁陷入深深的沉思——能不能让我先突破？,起点中文网,3.3,https://qidian.qpic.cn/qdbimg/349573/1017406011/300,https://m.qidian.com/book/1017406011/catalog
763,刃与召唤的异世界之旅,雾姬,二次元,221.5万字,完结,未知的情况下在异世界醒来……短短数月在充满疑惑的异世界得到了最强的力量！就这样，“蓝”开始了轻松还有后宫的异世界养成生活！,SF轻小说,6.0,https://rss.sfacg.com/web/novel/images/NovelCover/Big/2017/03/b05e3c96-aa03-4225-a4fa-a89eed88ae2d.jpg,http://book.sfacg.com/Novel/47816/
764,综漫从犬夜叉开始,西时雨,二次元,72.2万字,连载,真·书名：《穿越到犬夜叉的世界，娶了桔梗》 简介：卧室的衣橱变成时空门，通往犬夜叉的世界，准备好穿越了么？,刺猬猫,5.3,https://c1.kuangxiangit.com/uploads/allimg/c201015/15-10-20190258-27840.jpg,https://www.ciweimao.com/book/100206901
765,一觉醒来变成邪神的我有点方,不笑の黑喵,二次元,38.7万字,完结,讲道理，我就睡了一觉，醒来后就成邪神了？！ 草拟粑粑这道理没法讲了。 邪神到底该干什么啊？ 虚空中传来了谜之音：搞事搞事搞事！ 看着面前自称奈亚子的呆毛萝莉，某新任邪神从裙子里掏出了一根大丁丁。 虽然说有句话叫不约而同，但是…… 管它呢，先干为敬0v0。,刺猬猫,5.3,https://c1.kuangxiangit.com/uploads/allimg/c170404/04-04-17222532-56165-100029731.jpg,https://www.ciweimao.com/book/100029731
766,从猎人世界开始的猎人,永远十六岁,二次元,167.1万字,连载,穿越猎人世界，艾伦获得WOW猎人职业模板，结果一醒来就遇到了第一次参加猎人考试的“厕所战神”西索，不出意外被打成重伤，差点成为史上存活时间最短的穿越者。为了找回场子，给那张变态的小丑脸狠狠来上一拳，他带着自己的宠物暗影狼王鲁伯斯踏上了追去强大念能力的道路。,起点中文网,3.9,https://qidian.qpic.cn/qdbimg/349573/1023529013/300,https://m.qidian.com/book/1023529013/catalog
767,我的地下城没有问题,卢碧,二次元,115.5万字,连载,这只是一本单纯的恋爱冒险故事,起点中文网,5.5,https://qidian.qpic.cn/qdbimg/349573/1012700801/300,https://m.qidian.com/book/1012700801/catalog
768,综漫捕捉（灭世）计划,FFF大团长,二次元,18.5万字,连载,本书作者郑重声明： 　　1、本书主角是为了满足自我欲望，投靠外星邪神毁灭世界的人奸。 　　 2、主角的三观是反人类的三观，不能接受的小朋友速速退散。 　　 3、本书主线为主角获得金手指，将高人气的幻想作品具现到现实，满足自我欲望顺便毁灭世界。 　 4、主角所在的世界为平行世界的地球，书中一切国家，人物，作品与现实世界无关。 　　 5、平行世界的设定，以作者君脑补+度娘为准，可能与现实情况有所不同。 6、作者君的水表在门外，作者君不收任何快递，作者君谢绝女装请求。 　　—————————— 【√】我已详细阅读并同意以上协议,刺猬猫,5.4,https://c1.kuangxiangit.com/uploads/allimg/c171114/14-11-17103311-76961-100048644.jpg,https://www.ciweimao.com/book/100048644
769,家园远征军,坑王之王,二次元,97.4万字,完结,千亿的炮塔，千亿的光辉，强大的炮火之下，一切敌人都是纸老虎-----你们对真正的力量一无所知。 企鹅群号码：417357299,刺猬猫,5.0,https://novel-cdn.kuangxiangit.com/images/default.jpg,https://www.ciweimao.com/book/100022474
770,死亡代行者,七月酒仙,二次元,35.3万字,完结,【神脑洞系列--原创征文】 黑暗中，绽放着名为希望的洁白花朵,刺猬猫,4.5,https://c1.kuangxiangit.com/uploads/allimg/c171101/01-11-17132910-93037-100048622.jpg,https://www.ciweimao.com/book/100048622
771,我是魔鬼，只懂交易,九星少将,二次元,62.2万字,连载,我不是轻小说中的魔鬼，不是丢人的魔鬼，是个真正的魔鬼。 洛风看着想要走上将棋巅峰的空银子，想要改变人性的雪之下，想要保护朋友的拉菲尔，露出了愉悦的笑容。,刺猬猫,4.9,https://c1.kuangxiangit.com/uploads/allimg/c200529/29-05-20234214-47220-100175117.jpg,https://www.ciweimao.com/book/100175117
772,我！黑衣组织大佬,不是塔酱,二次元,86.6万字,完结,梁赞穿越到名侦探柯南的世界，成了黑衣组织的一员。 　面对各路特工、死神小学生、组织二五仔，梁赞不屑一笑。 　你说你比我会当二五仔，那上来比试比试？ 　什么叫国际大佬啊？ 　（战术后仰）,刺猬猫,5.9,https://c1.kuangxiangit.com/uploads/allimg/c200225/25-02-20133220-53526-100150681.jpg,https://www.ciweimao.com/book/100150681
773,异世-大秦,乌云天空,二次元,443万字,完结,如果一场战争不能解决恩怨，那就再来一场；如果一个人的牺牲不能够挽回大局，那就再牺牲更多的人。没有尽头的战争年代，一条血路铺就了两个文明的征服史和被征服史。谁是胜利者？只有啄食腐肉的秃鹫知道。,不可能的世界,6.7,https://c.8kana.com/201601/106/68/10668_b4166_1175_m.jpg,http://www.8kana.com/book/10668.html
774,战士远行,三十四年,二次元,14.8万字,连载,【游戏征文-游戏异界】 人总是渴求自己没有的事物。 以战神为名的他知道，自己从来不是一个战士。 因此当这个机会出现的时候，他义无反顾。 就是一个战士玩家在游戏世界锤炼自己的故事,刺猬猫,6.4,https://c1.kuangxiangit.com/uploads/allimg/c190724/24-07-19105315-32101.jpg,https://www.ciweimao.com/book/100117909
775,赤红辉耀,巧克力香草猫,二次元,196.9万字,连载,希尔柰兹教团最伟大神圣清廉公正的异端审判庭：这位小姐，我听说你是共产党员？ 索尼娅（掏出AK）：没错，老娘她娘的就是共产党员！,起点中文网,4.4,https://c1.kuangxiangit.com/uploads/allimg/c200818/18-08-20060647-16443-100003706.jpg,https://m.qidian.com/book/3616857/catalog
776,龙门无间道,梦惊蝉,二次元,319.3万字,完结,【游戏征文-游戏异界】 四书完本，放心观看。 “当初说好的三个月，三月之后又三月，三月之后又三月，这都一年了老大！我都要当上整合运动的头了！什么时候可以回龙门啊陈sir？” 修贤，一个莫名其妙到了龙门近卫局，然后莫名其妙被送去了整合运动当卧底的倒霉催的穿越者。 “你对我态度好点，整个龙门只有我知道你的身份。我回去把你的资料删掉，你一辈子就当个整合运动吧！” “拜托，我都快当老大了！你还让我留在那？带着整合运动打龙门啊陈sir！” “这事一过就让你回来。” “少来，这话我都听了九千遍了。这是情报。” 再次想要回归安定社会的修贤无奈的回到了整合运动。但是他却被带到了塔露拉的面前。 在修贤以为自己要暴露的时候.... “你来整合一段时间了，没底子，有实力，脑袋灵光，最重要的从没暴露过自己。组织给你个任务，去龙门，当个眼睛。 “代号，琴酒。”,刺猬猫,6.6,https://c1.kuangxiangit.com/uploads/allimg/c190902/02-09-19133110-58888-100119445.jpg,https://www.ciweimao.com/book/100119445
777,异界巨龙集团穿越协议,旅行的笔者,二次元,59.1万字,连载,协议日志101——禁止穿越巨龙造成任何危害一个种族存亡的事情 协议日志121——禁止吞噬本土龙类，在与本土龙类通婚前请先在集团内部登记 协议日志133——在不触犯协议日志101与121前提下，维护龙类利益，推进巨龙繁衍扩张，共创美好未来。 愿飞龙常驻汝梦 “航海家吹奏进军的号角，净化者焚烧了世界，点燃了战争的烽火，炼金之士带来恐惧的畸变，霜雪的哨兵遥遥相望，碧绿的记录者喷吐毒气，最后，一切都埋葬于仲裁官双翼的阴影下。诸君，古老的恐惧披鳞带甲而来，此为鳞君之时。”——《巨龙议会序言》,刺猬猫,5.3,https://c1.kuangxiangit.com/uploads/allimg/c180727/27-07-18201001-77813.jpg,https://www.ciweimao.com/book/100075796
778,花岗岩之怒,咱的小刀,二次元,38.7万字,完结,“石头会法术，神也挡不住”——前世903级的法师玩家楚维，一梦回到了游戏世界剧情未曾开始之前，成为了一块石头……,起点中文网,5.3,https://qidian.qpic.cn/qdbimg/349573/1016289581/300,https://m.qidian.com/book/1016289581/catalog
779,总之，先成为人生赢家,秋山澪,二次元,10万字,连载,穿越到平行世界，并且获得耳语者（Whisperd ）的能力，能够倾听黑科技之声。 少年还不知道自己的目标是什么，不知道自己的追求是什么，不知道自己的梦想是什么。 总之，不管想实现什么，先成为人生赢家绝对没错。 （综漫世界观，日常都市类，黑科技流，暂定春物，樱花庄…）,刺猬猫,5.4,https://c1.kuangxiangit.com/uploads/allimg/c190114/14-01-19144555-74846-100091248.jpg,https://www.ciweimao.com/book/100091248
780,舰娘俾斯麦,月别千秋,二次元,356.9万字,连载,新书《女生很nan》变身百合已完结。 俾斯麦号是第二次世界大战中，德国技术最先进、吨位最大的战列舰，她的欧派足足有两万吨！ 哦，我说了什么~ 经过了修文，删书后重新放书架观看效果更佳（去掉了那时候比较幼稚的描写） ps：欢迎加入瑟瑟发抖的蛐蛐波斯猫，群号：171619996；欢迎加入瑟瑟发抖的区区波斯猫，群号：573666910,刺猬猫,5.8,https://c1.kuangxiangit.com/uploads/allimg/c161109/09-11-16103143-37202-100001337.jpg,https://www.ciweimao.com/book/100001337
781,冬之庄的管理人助理,鲸飞了,二次元,153.3万字,完结,重生霓虹，言大佑来到福冈，成为了宿舍的管理人助理。他本想着自己会过上普通的人生，两个堂妹是普通的人，明日香姐姐只是位普通的管理员，这里也只是间普通的女子宿舍。可随着时间推移，他才发现，原来除了他之外，一切都不普通……——————————群号【878754279】欢迎来一起当咸鱼。,起点中文网,3.9,https://qidian.qpic.cn/qdbimg/349573/1018370534/300,https://m.qidian.com/book/1018370534/catalog
782,某科幻的星际漂流记,固有结界科学化,二次元,46.6万字,连载,严肃型星舰与星际战斗须知： 1，并没有绚丽的光束和填满爆炸物的舰桥，太空当中激光并不会留下光痕，并且当你看见光时，你已经死了。 2，并没有鬼畜的机甲和登舰作战，除非飞船在港区停着。 3，并没有厚实的装甲和结构，面对引力子武器而言，装甲并不能起到哪怕一丝的防护作用，屏蔽一个贯穿全部十个空间维的引力的作用的物质理论上是不存在的。 4，没有所谓的能量护罩和蜜汁能量武器，因为能量只是一个相对物理量，描述物质的属性，并非是一个存在的实体，所以，并不存在能量压缩，密度，纯度等蜜汁形容........只有定向能武器和电磁波束武器。 5，脸和速度即是盾！这是一个真实的非的干不过欧的世界。 6，一颗半径为4000-6000千米，可活动的陆地表面积占30%以上的类地行星真的不是蛐蛐几千个陆战队可以占领的，也真的没有人会选择从几百光年外运输上千万陆军士兵和他们的全套重武器来和你打一场地面争夺战。,刺猬猫,5.6,https://c1.kuangxiangit.com/uploads/allimg/c171212/12-12-17000245-20603-100053521.jpg,https://www.ciweimao.com/book/100053521
783,战术人形的废土工坊,云外绯想天,二次元,43.7万字,连载,核战后的废土上，要小心以下几种人物：1.穿着避难所衣服，牵着一条狗的小蓝人；2.拖家带口有傲娇岳父和贴心老婆的哑巴；3.带着不明货物的邮差；4.口头禅是“你已经死了”的强壮兄贵；5.钢板…………这是一只脱离了低级趣味，具备着人道主义精神，致力于建设废土的UMP45。“那边的普林斯顿！十松庄的马桶又堵了，你带人去处理一下！”,起点中文网,6.3,https://qidian.qpic.cn/qdbimg/349573/1016262438/300,https://m.qidian.com/book/1016262438/catalog
784,龙珠演义,翼赤火,二次元,136.1万字,连载,—————————————————这一路上走走停停，顺着少年漂流的痕迹—————————————————,起点中文网,3.7,https://qidian.qpic.cn/qdbimg/349573/1012341972/300,https://m.qidian.com/book/1012341972/catalog
785,我成了日式反派,和风遇月,二次元,58.4万字,完结,魂穿日本。原主相貌端正、成绩优异、家境优渥、不愁吃穿——怎么看都是一帆风顺的人生开局。结果西城式却发现自己好像是个反派?原主的死...似乎也不太对劲?,起点中文网,5.1,https://qidian.qpic.cn/qdbimg/349573/1019434562/300,https://m.qidian.com/book/1019434562/catalog
786,主管不死于嘴欠,三人塔,二次元,254.2万字,完结,为邻居看护宠物狗，帮朋友看管小孩，处理报废机器，简单轻松易懂的工作，明快健康的生活环境，包吃包住包工资。成为主管，您便能获得公司的一切。 您的努力将会让所有人过上幸福的生活，您的梦想将在这里实现，请加入我们，加入‘世界之翼’，为全人类而奋斗吧。 “但请谨记：唯有直面恐惧，才能创造未来。”,刺猬猫,5.6,https://c1.kuangxiangit.com/uploads/allimg/c180504/04-05-18173833-60070-100066390.jpg,https://www.ciweimao.com/book/100066390
787,宠物小精灵之黑暗巨头,铁腿水上漂R,二次元,132.2万字,完结,一个从来没有接触过游戏的普通人穿越到小精灵的世界，在没有显赫背景、没有金手指、没有神秘老爷爷的情况下，他该何去何从？书友QQ群：599653278粉丝QQ群：635234541新人新书，请大家多多支持。^O^,起点中文网,4.1,https://qidian.qpic.cn/qdbimg/349573/1010499446/300,https://m.qidian.com/book/1010499446/catalog
788,霍格沃茨之风云再起,木羽澜风,二次元,139.2万字,完结,【新书《当系统泛滥成灾》已经发布，求支持！】——《哈利波特》续集：故事发生在《哈利波特》击败伏地魔二十一年之后，主人公为莫林，神秘事务司遭到入侵，残存的时间转换器被盗，巫师界谣言纷飞，霍格沃茨风云再起！（无系统，无穿越，原著文风，续集小说，借助哈利波特的世界观写原创剧情。）QQ群：125287626——新书：《灵器复苏》欢迎捧场,起点中文网,7.3,https://qidian.qpic.cn/qdbimg/349573/1012521543/300,https://m.qidian.com/book/1012521543/catalog
