,title,author,sort,count,status,detail,site,rank1,cover,url1
384,雷之无限,栗子饭堂,二次元,22.9万字,连载,超级身体？无敌力量？数之不尽的财富？还是享之不尽的美女？ 无限的真谛到底是什么？ 路辰天认为，“大武极源”的理论，果然最合自己的口味！ 不需要思考，就是去轰，去轰，然后永无止境地强下去！ 然后，再所有人聚集在“武”之旗帜下高声歌唱： 伟大的白惊浪陛下永寿无疆！ 愿我们的大武极源一直变强！ （某种意义上算是《无限海虎》的续篇，内容就是无脑轰他妈。群号42874935）,刺猬猫,7.5,https://c1.kuangxiangit.com/uploads/allimg/c160613/13-06-16184235-25463-100012411.jpg,https://www.ciweimao.com/book/100012411
385,变身双胞胎女明星,素数,二次元,71.8万字,完结,穿越平行世界，变身成了一对双胞胎少女。 　　一魂双体的她们，振作精神，决定从学霸开始做起。,刺猬猫,6.0,https://c1.kuangxiangit.com/uploads/allimg/c170201/01-02-17035752-35199-100011226.jpg,https://www.ciweimao.com/book/100011226
386,我的系统总想逼我表白,雪满长安L,二次元,123.4万字,完结,本书为日常系画风，系统占比不大，欢迎品尝。【理论上本系统可攻略宇宙间一切具备思维能力的生物】【选定攻略对象后，宿主将随机获得该对象的技能等级和天赋水平】【攻略对象为同性时，技能经验获得速度+50%，技能等级上限-50%】【攻略对象不为同种族时，触发404光环，技能经验获取速度+100%，暴毙概率+99%】【攻略失败后，触发惩罚机制，宿主基础数值减半，进入绝对虚弱状态，重置技能等级】穿越而来的白川泽平看着这个槽点满满的系统，又看了看学年第一的美少女学神…嗯，或许…这位同学是一台不错的学习姬ps：本书又名《我的天赋来自女友》书友群：1106667035,起点中文网,5.1,https://qidian.qpic.cn/qdbimg/349573/1020389089/300,https://m.qidian.com/book/1020389089/catalog
387,那年那些穿越者,Mr星尘,二次元,160.4万字,完结,简介重新写了，反正就是是一个到处穿越世界一开始是一位不打算当带路党的术士，然后自己把自己弄成神经病的故事，大概吧！ PS：穿越的世界定在动漫、游戏和电影中，有哪位同学希望主角去到那些世界欢迎提出来。 别一下子太高就行了！龙珠和哆啦A梦这些规格外的世界就免了！ ——————————新书《猎人阁下需要委托》已经发布 PS：我不是依然包子、再次申明、我不是依然包子那个说不太监偏太监的。,刺猬猫,5.2,https://novel-cdn.kuangxiangit.com/uploads/allimg/c161008/08-10-16233931-99836.jpg,https://www.ciweimao.com/book/100020105
388,漫威之无限人格,公子海,二次元,122.2万字,连载,简单来说，这就是一个拥有着连自己都不知道自己到底有多少副人格，而且这些副人格们的原型都是各个世界的风云人物的家伙，在漫威世界搞事情的故事！快银：你怎么可能追上我！雷蒙：速度即力量，年轻人，你有被光踢过吗？洛基：为什么你能无视我的幻术魔法？雷蒙：觉悟吧，我愚蠢的欧豆豆呦~~~钢铁侠：你……到底是谁？雷蒙：吾乃威震天，霸天虎的领袖！【温馨提示①:本书背景是‘漫威无限人格宇宙’，请勿对号入座！】【温馨提示②:对漫威背景不熟悉也不影响阅读，请放心食用！】,起点中文网,4.3,https://qidian.qpic.cn/qdbimg/349573/1013451084/300,https://m.qidian.com/book/1013451084/catalog
389,火影之主神系统,咸鱼王宝渣,二次元,36.3万字,连载,李晨穿越到火影世界，代替了本该在战争中死亡的纲手的弟弟绳树，却获得了一个奇怪的主神系统，居然可以将别人设置成自己的“轮回者”，向他们颁布任务，让他们成为自己的打工仔，为自己赚取积分！【任务奖励：木遁血继限界。】【任务失败：抹杀。】被迫成为轮回者的纲手，脸色阴晴不定的看着系统颁发的任务，拿起了电话。“弟弟，你过来一趟。”“怎么了？姐姐。”“算了，还是我自己过去吧……”PS：Q群群号：435556558，欢迎加入，进来讨论剧情，催更什么的……,起点中文网,5.2,https://qidian.qpic.cn/qdbimg/349573/1004169838/300,https://m.qidian.com/book/1004169838/catalog
390,最后的狮骑士,灰白之裔,二次元,117.4万字,完结,正常版简介：潘德立国后的第354年，神明将命定的英雄汇聚。他是马迪甘的预言，乌勒·维特的利箭，他用火与剑将潘德的秩序重塑，终建立起星落于地上的国。 简洁版简介：这潘德吃枣药丸。 作者对着美少女万华镜思考完人生后写出来的简介：故事的主角西格·拉普拉斯是某位巴克利小小姐的高级打手，在小小姐以神为目标的罪恶事业里出色的贡献了自己的力量，其罪名包括但不限于冒顶自己的主君，勾引别国女骑士，诱拐小萝莉，杀人先祖又调教子孙，沉迷男色不可自拔，亵渎女神.....迷雾山、异端、迦图、拜蛇教等势力对此纷纷予以强烈的谴责。 新坑《黄毛勇者异闻录》。 入群答案改了，是新书男主角名字的西语写法。,刺猬猫,5.5,https://c1.kuangxiangit.com/uploads/allimg/c170201/01-02-17011523-34887-100021276.jpg,https://www.ciweimao.com/book/100021276
391,女装炼成,叫我神灵大人,二次元,95.3万字,连载,【神脑洞系列--原创征文】 　　又名《为了不变成女孩子的我不得不穿上女装》 　　“你成年后会变成女孩子哦！” 　　在穿越十五年后，夏尔遭遇到了自己人生最大的危机。他从自己的母亲（父亲？）那得知，如果无法成为传奇，成年后自己就会变成魅魔。而在这时，战五渣的夏尔却得到了穿上女装就能变强的能力。 　　夏尔：我夏尔就是死，从城堡上跳下去，也不穿女装！ 　　夏尔：穿女装真有趣！ 　　夏尔：放弃吧，论美貌你是比不过我的！ 　　…… 　　书友群，入群请说明是书名哦～ 　　118741855爱丽丝的秘密， 　　478493839神灵大人的咖啡屋 　　160064908神灵大人的茶屋,刺猬猫,6.3,https://c1.kuangxiangit.com/uploads/allimg/c171029/29-10-17141314-62337-100046939.jpg,https://www.ciweimao.com/book/100046939
392,Re:从零开始的异世界生活,天闻角川,二次元,158.1万字,连载,在异世界陷入迷茫的普通高中生菜月昴，邂逅了一位银发的美少女。但想助她一臂之力的昴，却一次次地遭遇敌袭，背叛、暴力，甚至是死亡……“死亡重置”——无力的少年拥有的唯一能力，能将死后时间倒转回一开始。使用了这般力量，便会失去过去的回忆，可为了守护最重要的人们，昴必须抗争到底。“即使你忘却了我，我也不会遗忘你。”,SF轻小说,6.8,https://rss.sfacg.com/web/novel/images/NovelCover/Big/2019/01/b2dbbb8a-d88f-41d0-b3dc-e8a5cbea3314.jpg,http://book.sfacg.com/Novel/49325/
393,台城一中的马研社,火炎焱燚者,二次元,27万字,连载,每个人的自由发展是一切人的自由发展的条件。——某个不允许被透露名称的宣言 台城一中马克思主义理论研究社，理论研究兼实践型社团。创始人员两名：社长赵民劳与副社长赵文韬。欢迎任何对某个不允许被透露名称的理论体系和某个不允许被透露名称的运动史有兴趣的同学加入。 此外，本社团承接一切可以承接的无偿服务，包括但不仅限于心理咨询、人生商谈、代递情书、调解纠纷、思想品德和历史科目辅导等一切在校规校纪允许内且不需要过分体力劳动的项目。 另，对兵棋推演活动有兴趣的同学可来我处与副社长赵文韬进行讨论。 台城一中马研社 宣,刺猬猫,6.0,https://c1.kuangxiangit.com/uploads/allimg/c170918/18-09-17151445-87985-100045434.jpg,https://www.ciweimao.com/book/100045434
394,你们二次元真会玩,大笨淡,二次元,217万字,完结,汤昊：“朋友，听说过二次元聊天室吗？”路人A：“没听过，干什么的？我加入有什么好处吗？”汤昊：“当然，里面的人个个都是人才，说话又好听，还能欣赏到各种才艺表演，比如魔少女大战触手怪，法老王的坟头对撞，超电磁炮对抗五彩大炮，星爆弃疗斩VS三千世界，以及我们群里最年轻的两位紫色老……美少女已经决定正式出道成为偶像。”“另外，如果你喜欢旅行的话，可以乘座我们每周一例行的凯尔特航空，前往从温州到加拿大的旅途，同时还能免费观看大型情景电视连续剧《哈哈哈》，怎么样，是不是有点小激动？”“……我可以喊救命吗？”“晚了，一切都是命运石之门的选择！”书友群：6-1-6-8-0-6-8-2-3,起点中文网,4.6,https://qidian.qpic.cn/qdbimg/349573/1013303296/300,https://m.qidian.com/book/1013303296/catalog
395,漫威世界的替身使者,无面凄凉,二次元,173万字,完结,新书《这个忍者明明不强却过分作死》已发布，求大家的推荐票和收藏~【起点首部替身使者精品，高订过万，欢迎试毒】JOJO？不，本大爷是dio哒~！带着爆肝一礼拜的残次品JOJO坑钱手游穿越到漫威世界的程序猿正一脸懵逼的审视着自己的新身份——迪奥·布兰度，一个英华混血的大帅比！不过，等会儿......这里是漫威世界？请问离紫薯精到达战场还有多长时间？对了，老子还有金手指！白金之星，世界，疯狂钻石，轰炸空间，黄金体验，绯红之王......统统给我出！叮，新玩家您好，您的第一位替身已抽取，祝您游戏愉快。看着眼前正对着自己笑嘻嘻的‘小西红柿’，作为漫威世界唯一的替身使者，迪奥大爷双眼无神的望着天空，果然是玄不救非，氪不改命！PS：没看过JOJO也不影响观感体验，可以将替身理解为拥有各种神奇能力的守护灵。,起点中文网,4.0,https://qidian.qpic.cn/qdbimg/349573/1014947066/300,https://m.qidian.com/book/1014947066/catalog
396,精灵世界夹缝求生,岑自省,二次元,142.6万字,连载,一个穿越者再次重生的故事，一个真实的神奇宝贝世界，一个培育使用宠物小精灵的奇妙世界，阿利多斯、龙王蝎、耿鬼、水晶灯火灵……（欢迎来群：693721996）前世无论繁华、屈辱都已经落幕，今生的雄关漫道还需从头迈步。强者之路，必将与孤独为伍；冷漠、杀伐、伪装、隐忍只要是通往强者之路的捷径，他都会毫不犹豫地踏上去。,起点中文网,4.1,https://qidian.qpic.cn/qdbimg/349573/1011064194/300,https://m.qidian.com/book/1011064194/catalog
397,地狱乐园计划,兵库北番长,二次元,144.5万字,连载,因为种种原因，魔鬼可以通过人心中的恶意，饲养出自己的恶魔。 又因为种种原因，罗宁变成了魔鬼。 “我只想养可爱漂亮的恶魔啊！所以不是美少女的家伙去死好了，不要随便堕落给我添麻烦啊！” 就这样，罗宁这个不正经的魔鬼，在旅途上不断扩充着自己的恶（后）魔（宫）卫队。 读者群（艹粉群）1群： 94551718（未满），2群：548741230（已满），加群验证书名,刺猬猫,4.3,https://novel-cdn.kuangxiangit.com/uploads/allimg/c170418/18-04-17152517-5265-100004069.jpg,https://www.ciweimao.com/book/100004069
398,魔方世界,羊角猫！,二次元,142.7万字,完结,这是个游戏文，嗯... 还是个女主文.,不可能的世界,6.5,https://c.8kana.com/201612/130/91/13091_57bce_3075_m.jpg,http://www.8kana.com/book/13091.html
399,我给万物加个点,常世,二次元,306.2万字,完结,【高订3w+的精品小说，起点编辑联合推荐】给物品加点，可以让物品拥有奇怪的特殊能力，给动植物加点，可以改变它们的形态，可以点化它们成妖怪，给自己加点，可以获得种种技能，天赋和超能力，这是一个有趣的故事，生活向轻松小说。已给地球、系统、主角自己、手机、游泳池、马戏团、书本、沙漏、豹子、竹林等等加点...尽情期待后续内容。===常世读者1群：664616129（2000人已满，所以加2群吧）=====常世读者2群：233122761（很多空位哟）======vip读者群：777015057（粉丝值8000以上，加群前请找管理验证截图）===已有高订8000+精品完本小说《神级采集术》。新书《我的云养女友》正火热连载中....,起点中文网,4.0,https://qidian.qpic.cn/qdbimg/349573/1015338557/300,https://m.qidian.com/book/1015338557/catalog
400,奥丁,牧官,二次元,194.1万字,完结,这是一个被雷百劈百中的智障瓜皮突然有一天被劈后变得无比聪明，热爱学习、渴求知识、成为巨佬学神、改变世界、篡权神王的终极俗套故事。 　　…… 　　新书《我将一次不死并且超神》已发布 　　……,刺猬猫,4.8,https://c1.kuangxiangit.com/uploads/allimg/c181105/05-11-18033653-535-100075798.jpg,https://www.ciweimao.com/book/100075798
401,开局东京地爆天星,雨后不带刀,二次元,21.2万字,连载,穿越第一天，我在东京地爆天星。一颗陨石悬吊在东京正上空。1300万东京居民。3700万东京圈居民。都处在陨石阴影的笼罩下。………………非幕后黑手，杀伐果断。,起点中文网,4.6,https://qidian.qpic.cn/qdbimg/349573/1020356523/300,https://m.qidian.com/book/1020356523/catalog
402,这个世界到底是什么画风,嫌疑人x,二次元,63.3万字,完结,【神脑洞系列--原创征文】 苏叶刚穿越的时候，看见母亲欢快地殴打着父亲，而父亲无力抵抗地碎碎念。 他想：哦，是女尊文。 苏叶小学的时候，虽然吵吵闹闹但感情很好父母因车祸而亡，他为了姐姐能够继续读书而辍学了。 他想：嘿，是生活文。 苏叶十五岁那年，遇到了异能者。 他想：咦，是都市文。 然后——苏叶的系统冒了出来， 他想：恩，是系统文？ 苏叶被姐姐逆推的时候。 他想：哈，是骨科文！ 苏叶被很多女孩子逆推的时候，他终于明白了——原来，这是后宫文。,刺猬猫,6.2,https://c1.kuangxiangit.com/uploads/allimg/c170902/02-09-17111439-70020.jpg,https://www.ciweimao.com/book/100044096
403,欺诈师,猫牙子,二次元,66.4万字,连载,一个三流骗子和一群阴谋家的故事。,刺猬猫,7.2,https://c1.kuangxiangit.com/images/default.jpg,https://www.ciweimao.com/book/100018293
404,某病娇少女的治疗计划,海利昂黎明星,二次元,90.1万字,完结,假如有一个女生没由头的近乎疯狂地喜欢着你，那么就可以基本断定她的病娇属性。在悲叹自己为什么会是选中之人之余，为了不让自己的生活更加悲惨，只好踏上了去治愈病娇绝症的不归路。,SF轻小说,6.3,https://rss.sfacg.com/web/novel/images/NovelCover/Big/2016/11/abc8d926-1c16-4345-8627-718911fa950f.jpg,http://book.sfacg.com/Novel/50076/
405,刀剑神域之活下去,紫蓝色的猪,二次元,64.1万字,完结,嫉妒、憎恨、绝望、愤怒、恐惧……纷飞的玻璃碎片成了最残忍的一道风景。这里是刀剑神域的世界，一个死亡游戏。在这里，欢颜难见。在这里，只有战斗。－－－－－－－－－－－已完结小说：海贼王之漫漫长路，刀剑神域之活下去。新书：火影之祸害收藏和票票赶紧滴！,起点中文网,6.3,https://qidian.qpic.cn/qdbimg/349573/2841589/300,https://m.qidian.com/book/2841589/catalog
406,火影之最强卡卡西,墨渊九砚,二次元,195.2万字,完结,九尾之夜，现世的灵魂与卡卡西融为一体。从此开启一条不同的火影之路。写轮眼，雷遁，刀法，仙术，成就最强。绝对的火影味道！火影卡卡西结束，番外篇夏目友人帐新书《木叶墨痕》正版书友群：555050388,起点中文网,4.4,https://qidian.qpic.cn/qdbimg/349573/1005115417/300,https://m.qidian.com/book/1005115417/catalog
407,最后一个契约者,夜南听风,二次元,93万字,完结,【动漫无限流】这是一个不一样的主神空间，这是一个不一样的轮回世界，这是一个不一样的无限故事。当空间崩溃，只剩下唯一一个契约者的时候，他将在无限的动漫世界为所欲为。契约者、轮回者、游戏者……谁人敢与挂B一战？！…………………风盟2群:580391329,起点中文网,3.6,https://qidian.qpic.cn/qdbimg/349573/1012918439/300,https://m.qidian.com/book/1012918439/catalog
408,三千万年前的迪迦,冬想,二次元,58.6万字,完结,三千万年前，那是巨人、怪兽、人类的时代。黑暗、光明交错，邪神降临，灭世之花盛放。世界需要英雄！***最喜欢的奥特曼是迪迦、杰克，老早就想写一篇奥特曼的同人了，这篇主角迪迦，登场怪兽借用克苏鲁新书《神话搬运工》！,起点中文网,7.4,https://qidian.qpic.cn/qdbimg/349573/1003788736/300,https://m.qidian.com/book/1003788736/catalog
409,捉妖奶爸,火中物,二次元,219.9万字,完结,这是一个宅男蜕变为无敌奶爸的故事！我的娃，由我来守护！什么？孩子妈有意见？咱们回房，我给你正一正三观！【原名：无敌奶爸的捉妖日常】【火锅粉《一号桌》群号：489337956，进群无限制。】【火锅粉贵宾席：9897952，进群需2000粉丝值验证。】【十三年老作者倾力奉献，水平稳定，大局观血强。】,起点中文网,5.4,https://qidian.qpic.cn/qdbimg/349573/1011121140/300,https://m.qidian.com/book/1011121140/catalog
410,猛男战记,八八三,二次元,158万字,完结,烽烟乱世冷如冰，唯有奶子暖人心！ 新书《大主教的神明创造》将于2020年1月1日正式发布！尽请关注！,刺猬猫,5.7,https://novel-cdn.kuangxiangit.com/uploads/allimg/c170901/01-09-17133413-20019-100028802.jpg,https://www.ciweimao.com/book/100028802
411,爷和女鬼硬碰硬,旋转冻玉米,二次元,63万字,连载,【主角弱智、情节暴走、内含嘴臭、黑色幽默、无厘头搞笑，不喜勿入】 遇到女鬼怎么办？ 正常人：“跑路。” 阴阳师：“除灵。” 僧侣：“度化。” 猫客读者：“追她！” 霍折：“爷一拳打在女鬼脸上然后揪着她的头发让她承认这个世界上根本没有鬼最后把她骨灰都给扬咯！”,刺猬猫,6.2,https://c1.kuangxiangit.com/uploads/allimg/c200423/23-04-20154541-79671-100163180.jpg,https://www.ciweimao.com/book/100163180
412,满级的我，在灵异画风的仙侠世界混吃等死,剑飞惊天,二次元,145.4万字,完结,【IP征文大赛】 穿越了，出生满级很OK，可是杨柳细腰的母亲吊打身强体壮的父亲什么鬼？ 　　这个世界女子带兵打仗，男子在家相妻教子？女孩子要刻苦修行，飞黄腾达，而男孩子最好要长相清秀，琴棋书画，这样才能嫁一个好人家？ 　　等等，那横梁上的水鬼，被烧毁后依旧传来阵阵读书声的私塾，自古相传别赶夜路的规矩，以及喜食人耳的“圣人”又是什么意思？ 　　仙侠版恐怖故事？ 　　顾九觉得，这个世界有问题，但他想的却是如何混吃等死。 　　“人生不就是一场吃吃喝喝睡睡还一直处在巅峰的故事吗？”——某年某月史上最懒圣人顾九如是道。,刺猬猫,4.1,https://c1.kuangxiangit.com/uploads/allimg/c180701/01-07-18111842-19606.jpg,https://www.ciweimao.com/book/100072934
413,我的女友是大小姐,愤青别来这,二次元,76.3万字,连载,我现在来到的这个世界有点梦幻，就读的学校叫秀知院学院；去世的老妈是日本的前首相加百兆大富豪加穿越者；干爹樱木花道是前nba名人堂球员刚从爵士队退役；教父野原新之助是日本的国民mc；家里的棋盘里住着两个千年老妖怪！一个叫佐为一个叫……在这神奇的世界里，我开始了拍视频，下棋，被迫打球的精彩生活。（请支持正版，本作前期有不少修改，dao版都没有修改。）本书又名：《我在异世界当up主》；《樱木花道逼我打篮球》；《两个棋圣骗我下围棋》；《蕾姆大小姐和我下棋》；《便宜老爹想让我成为游戏大亨》；《背刺裴总的快乐生活》,起点中文网,2.1,https://qidian.qpic.cn/qdbimg/349573/1024171028/300,https://m.qidian.com/book/1024171028/catalog
414,向美丽的银龙献上婚戒,御白狐,二次元,125.5万字,完结,莱维在迷迷糊糊中去屠龙，然后成功被龙给屠了，无奈之下拿出戒指—— 　　龙认为眼前的人类在向它求婚。 　　龙答应了，现在你们成为夫妻。 　　“？？？”莱维的表情凝固了。 　　总之，这是莱维成为房奴为了与龙共筑爱巢而努力攒钱的传说…… 　　【书友群是：634502530】,刺猬猫,4.5,https://c1.kuangxiangit.com/uploads/allimg/c170414/14-04-17052218-13538-100028321.jpg,https://www.ciweimao.com/book/100028321
415,我，安艺伦也，不当舔狗,五月十六,二次元,137万字,连载,我，安艺伦也，不做游戏，不当死肥宅，也不当舔狗，只想好好学习！ 我要考东大，学习使我快乐！ 动画、漫画、游戏、轻小说，还有女人，都给我爪巴！,刺猬猫,4.5,https://c1.kuangxiangit.com/uploads/allimg/c190710/10-07-19225632-87546-100103183.jpg,https://www.ciweimao.com/book/100103183
416,从火影开始掌控时间,夜南听风,二次元,192.6万字,连载,【已穿梭世界】火影——海贼王——一拳超人——死神——妖精的尾巴——？？？穿越到火影世界的枫夜灵魂融合了一个能控制时间的时钟，他在无尽的世界中穿行，只为掌控时间！………………风盟2群:580391329VIP群（2000粉丝值）：551636011,起点中文网,4.3,https://qidian.qpic.cn/qdbimg/349573/1017621987/300,https://m.qidian.com/book/1017621987/catalog
417,海贼世界没有救世主,半碗红烧肉,二次元,143.4万字,完结,这是一个手无缚鸡之力的男主角在海贼的世界里用语言的武器武装海贼们思想的故事。男主因为现代人体质手无缚鸡之力！手无缚鸡之力！手无缚鸡之力！,起点中文网,4.6,https://qidian.qpic.cn/qdbimg/349573/1018299048/300,https://m.qidian.com/book/1018299048/catalog
418,1860战记,怨念法师,二次元,37.7万字,完结,"问：如果今天的天朝【集体成建制】瞬间回到1860，会发生什么事情？ 　　答：1860年啊,黄人就来了不列颠,先轰塌西敏寺后烧了白金汉…………",刺猬猫,3.5,https://c1.kuangxiangit.com/uploads/allimg/c170716/16-07-17144704-31263-100035235.jpg,https://www.ciweimao.com/book/100035235
419,木叶之忍者人生,牛逼的迈克雷,二次元,115.2万字,完结,武田秀一在意外电疗后穿越到木叶村。“这就是下忍的实力？我秀日天服了！”全方位解读查克拉和忍术。,起点中文网,5.6,https://qidian.qpic.cn/qdbimg/349573/1022117371/300,https://m.qidian.com/book/1022117371/catalog
420,反派NPC求生史,落落不大方,二次元,261.2万字,完结,一觉醒来穿越成一个NPC!还是炮灰NPC？这绝壁分分钟领便当的节奏啊！要想活命赶紧抱紧主角大腿，原本以为躲过了“觊觎小师妹美色被废修为后遭惨手”的命运，什么？竟然是个反派BOSS?!嘤嘤嘤，我要回家！,SF轻小说,5.6,https://rss.sfacg.com/web/novel/images/NovelCover/Big/2017/01/53874ddf-fac0-45b1-a4fc-d76d077e6918.jpg,http://book.sfacg.com/Novel/43708/
421,精灵之传奇训练家,铁腿水上漂R,二次元,266.3万字,完结,"起点精品PM小说现实向目前已有240万字数，很是肥美慢热类型，欢迎各位书友老爷长期阅读QQ群：1群820980411,2群832403775",起点中文网,3.6,https://qidian.qpic.cn/qdbimg/349573/1012513342/300,https://m.qidian.com/book/1012513342/catalog
422,铸星泰坦,月饼,二次元,136.1万字,连载,"【奇幻征文大赛】 穿越成未来boss，还在奇幻世界开超级机器人的我，是不是哪里不对？ 用魔法改造COS战锤星际战士的艾文如是说道。 帕拉迪亚，一个曾经剑与魔法的世界，但…… 中央帝国林德正迎来第一次魔导工业革命，蒸汽朋克! 掌握秘仪的魔国埃隆德发起光荣革命,咒术改造！ 千塔之城地下暗流涌动，魔法学院都市！ 非人种族群居的大荒森内重现龙群之影，雪豹咬尾巴！ 商业城邦，航海家们分享着有关新大陆的传说，大航海时代！ 黑暗中，四位邪神狂笑着高举酒杯，为即将到来的新浪潮献上亵渎的祝词。 新历1885年12月，来自地球的穿越者抵达异世界……",刺猬猫,5.7,https://c1.kuangxiangit.com/uploads/allimg/c200311/11-03-20133529-13729-100154634.jpg,https://www.ciweimao.com/book/100154634
423,不充钱你能变强么,企鹅老爷,二次元,93.3万字,连载,马腾：“我就是饿死，从这儿跳下去，也绝对不往这坑爹系统里充一分钱！” 系统提示：“亲爱的玩家您好，商城最新上架感恩祭特殊扭蛋，十一连保底必中六星史诗装备，还有新品追随者契约，萌萌哒剑圣萝莉等您抱回家~” 马腾：“……艹，买买买，全都买！” 在普通的异界幻想故事里得到了氪金游戏的系统，请问该怎么办？在线等……挺急的！ PS：书友群 122083219 ，入群申请随便写，让我知道是看书来的就成~,刺猬猫,6.0,https://c1.kuangxiangit.com/uploads/allimg/c160802/02-08-16101218-68457-100015782.jpg,https://www.ciweimao.com/book/100015782
