,title,author,sort,count,status,detail,site,rank1,cover,url1
292,凌天传说,风凌天下,玄幻,217.1万字,完结,我名凌天，我欲凌天！穿越到异世的武学天才，超卓的武功，绝世的智慧；且看凌天如何在异世只手舞风云，左右逢源、文武双绝、威动天下；造就一个永恒的凌天传说！翻云覆雨天假手，兴衰两世我独狂！谈笑之中风云舞，剑气凌风任飞扬,起点中文网,5.9,https://qidian.qpic.cn/qdbimg/349573/1175246/300,https://m.qidian.com/book/1175246/catalog
293,巫师世界的法师,万色返空龙,玄幻,49万字,连载,掌握了DND世界中广阔奥术知识的穿越者法师卡萨，在一次失败的传送中又穿了，这次是哈利波特的世界。什么，哈利怎么办？这关卡萨什么事呢，他又不是救火队员。至于女主的人选，似乎也和其他人的选择不太一样哦。当法师遇到巫师，究竟会怎么样呢？（内有私货，不喜请略过）,纵横中文网,6.0,http://static.zongheng.com/upload/cover/2010/12/1292581567581.jpg,http://book.zongheng.com/book/68590.html
294,纯阳武神,十步行,玄幻,475.2万字,连载,浩瀚星空下，一个妖魔横行的世界。在这里，流云铁袖可以吞纳风云，九字真言可以降妖伏魔，太极拳剑可以扭动乾坤，这是一个属于武道的大汉天朝。当诸强的后代斩断传承，亿万年的战血蒸干混沌。当沉寂的战魂复苏，当时空成为永恒，年老的人皇踏着轮回转身。这是属于一个骑乘龙首的蝼蚁传说，百战不死的人族神话！普通群：246558156vip订阅群（需验证）：322234575欢迎加十步微信公众号“十步行”,起点中文网,4.4,https://qidian.qpic.cn/qdbimg/349573/3657207/300,https://m.qidian.com/book/3657207/catalog
295,超级神基因,十二翼黑暗炽天使,玄幻,730.6万字,连载,未来波澜壮阔的星际时代，人类终于攻克了空间传送技术，可是当人类传送到另一端的时候，却发现那里并不是过去未来，也不是星空下的任何一片土地……神秘的庇护所世界，无数强横的异生物，人类迎来了令人热血沸腾的飞跃性大进化，开启了星空下最辉煌璀璨的新纪元。“猎杀神血生物黑甲虫，获得神血黑甲虫兽魂，食用神血黑甲虫血肉，可随机获得0至10点神基因。”,起点中文网,4.6,https://qidian.qpic.cn/qdbimg/349573/1003692682/300,https://m.qidian.com/book/1003692682/catalog
296,捡了本天书,麻烦,玄幻,200.5万字,完结,我叫二一，二是……好吧，这不重要！重要的是，我被一本天上掉下来的书给砸破了头，然后我就开挂了！翻开了封面，我学会了[阅读术]、[解读术]、[概括术]、[解析术]……妈妈再也不用担心我的学习了。翻开第一页，我学会了[医疗动物]、[动物交谈术]、[动物变异术]……我是不是该去当个兽医，或者去国外买个农场？再翻到后面看看？咦？[即兴创作]、[美妙歌喉]、[完美容颜]……我是不是该去混一下演艺圈？还有[治愈术]、[复活术]、[占卜术]、[预言术]……我是不是应该去当个老军医，或者冒充神棍骗点钱花花？[蛛丝术]和[蛛行术]是什么鬼？逼着我我COS蜘蛛侠？那再学个[构装启智术]，岂不是要逼着我去当钢铁侠？,起点中文网,4.6,https://qidian.qpic.cn/qdbimg/349573/1010938502/300,https://m.qidian.com/book/1010938502/catalog
297,刺客猎人,洛水,玄幻,31.9万字,连载,他是冒险探宝的猎人， 他是穿梭黑暗的刺客， 他，就是黑暗本身。 少年卧底神秘的刺客组织——血狱会，历经生死考验，斗智斗勇，一步步走向权力巅峰 这里有反生命的神奇“里世界”，展现着各种匪夷所思的“东西”。 这里有百大奇诡的“表世界”，潜伏着无数神秘生物的外域。 犬牙交错的各方势力；身怀绝技的无数高手；惊险刺激的冒险；光怪陆离的奇遇。这是一次与众不同的修炼之旅，看俊秀少年如何逐步揭露那个世界危险的真相。本书引入前所未有新概念——反生命。 《白狐天下》《知北游》原作者洛水携新书《刺客猎人》再战江湖,创世中文网,7.4,http://wfqqreader.3g.qq.com/cover/361/243361/t5_243361.jpg,http://chuangshi.qq.com/bk/ly/243361.html
298,神宠进化,酒池醉,玄幻,181.2万字,完结,PS：本书别名——《宠物进化》新纪元来临，天地异变。地星本土动植物疯狂变异、返祖，异界物种沦落地星，最终新纪元人类诞生一种全新的职业御使。收服怪物，培养怪物，训练怪物，这就是御使。一个怀揣着梦想的少年懵懵憧憧的被一脚踢入这个黄金盛世。高鹏：就算是一条泥鳅，我也能将他进化成一只翱翔九天的真龙。-------------------------------------------致敬《宠魅》、《神奇宝贝》、《数码宝贝》，致敬我们每个人都有过的神宠梦。这是一本纯粹的宠物文。本书目前只有QQ读者交流群:724478458，有兴趣的朋友可以加入。,起点中文网,5.6,https://qidian.qpic.cn/qdbimg/349573/1011512936/300,https://m.qidian.com/book/1011512936/catalog
299,从大佬到武林盟主,小楼听风云,玄幻,216.2万字,完结,闯荡江湖、闯荡江湖，闯到头儿了，也没能看清楚这江湖是个啥样……VIP全订群：天下会109158714（有验证）,起点中文网,5.3,https://qidian.qpic.cn/qdbimg/349573/1015057056/300,https://m.qidian.com/book/1015057056/catalog
300,我在幕后调教大佬,阎ZK,玄幻,233.2万字,完结,新版简介这是一个炼假还真的故事。在步步杀机的修行之世里，谨小慎微。让熟悉的神话化为现实。在陌生的修行盛世里，令天庭重镇三界，地府执掌幽冥。让人皇持剑轩辕庇护苍生，让稷下学子传道九洲。回首之时，我三界已真实不虚。那并非传说神话。这，就是真正的历史。旧版简介——妖魔，神灵，怪异。云上俯瞰天下的灵，行走在大地上的人。赵离一头载入了这个危险的时代，直接地狱开局。唯一的破局在于他异变的梦境。为了拼命活下去，他不得不走上一条在梦里具现出各大传说故事的角色，然后想方设法抓人入梦，‘培养’这批人的道路。,起点中文网,5.4,https://qidian.qpic.cn/qdbimg/349573/1020396543/300,https://m.qidian.com/book/1020396543/catalog
301,墟界中走出的强者,乘风御剑,玄幻,332.2万字,完结,强者无惧、强者无畏、强者至强、强者无敌。科技的发展带来武者的末日？但……当李求仙自核爆中心安然无恙走出来时，世界震撼！……一个无修真、无魔法、无异能、无真气的世界，一个纯粹的武者世界。……新书《煌煌天道无上剑宗》发布，请大家继续支持。,起点中文网,3.9,https://qidian.qpic.cn/qdbimg/349573/1011833256/300,https://m.qidian.com/book/1011833256/catalog
302,无限制演绎,氪金改命,玄幻,129.1万字,完结,新书《BOSS降临现实》英雄，枭雄，好人，坏人，善良，邪恶……不能只想活下去，目标要更远大一点，比如……活的更好。,起点中文网,5.1,https://qidian.qpic.cn/qdbimg/349573/1013519844/300,https://m.qidian.com/book/1013519844/catalog
303,农夫凶猛,懒鸟,玄幻,232.7万字,完结,穿越成一个农夫？没问题，毕竟英雄不问出身。何况我还能看见属性栏，开局就有一个金手指是真香啊。但是等等，好像哪里有点不对。领主大人拿出来的那是什么？只见白光一闪，又有一个农夫扛着锄头呆呆傻傻的出现了……（书友群1074—4233—76）（VIP群4274—72089）,起点中文网,5.7,https://qidian.qpic.cn/qdbimg/349573/1020544103/300,https://m.qidian.com/book/1020544103/catalog
304,混乱战神,撞破南墙,玄幻,236.2万字,完结,做弱者，多不得好活做强者，多不得好死所谓命运，就是在不得好活与不得好死之间做一个选择一个在现代所存在的少数修真者之一，在一次不幸的事故中，他的肉体在同归于尽的大爆炸中被毁，他力保一丝元神不灭，来到了一个完全陌生的魔法世界，一切重新开始，从一个落魄贵族成为称霸大陆的混乱战神，这一切已经不能用传奇来概括，因为这就是战神的生活。（本人已有全本作品三部，请放心收藏阅读）VIP专用群：21138355Vip专用群：73830326混乱群1254455混乱群43104647,起点中文网,7.1,https://qidian.qpic.cn/qdbimg/349573/1280156/300,https://m.qidian.com/book/1280156/catalog
305,怪物乐园,酒煮核弹头,玄幻,366.9万字,连载,八百年前，世界各地的天空开启了三千座虚空大门，宛若三千颗不同颜色的眼瞳悬挂于天穹之上，无数怪物从眼瞳之中汹涌而出。整个世界，成为了怪物的乐园……八百年后，有个叫林煌的男人说：这个世界的所有怪物，只要我想要，都会成为我的召唤兽。【这是一条备注：本书是异界宠物召唤流。】,起点中文网,5.1,https://qidian.qpic.cn/qdbimg/349573/1005226649/300,https://m.qidian.com/book/1005226649/catalog
306,异世界的美食家,李鸿天,玄幻,615.6万字,完结,在武者举手可裂山川，甩腿可断长河的玄幻世界中，存在着这样一家小餐馆。小餐馆不大，但却是无数顶尖强者趋之若鹜之地。在那儿你可以品尝到用凤凰蛋和龙血米炒成的蛋炒饭。在那儿你可以喝到生命之泉配朱果酿制的烈酒。在那儿你可以吃到九阶至尊兽肉配上黑胡椒的烤肉。什么你想把厨师掳回家？不可能，因为餐馆门口趴着一只看门的十阶神兽，地狱犬。哦，那个厨师还有一个可以单手捏死九品至尊的铁疙瘩助手和一群被征服了胃的疯狂女人。本书讨论群一群：550248234（已满）欢迎大家加入二群：208206733,起点中文网,2.7,https://qidian.qpic.cn/qdbimg/349573/1004073922/300,https://m.qidian.com/book/1004073922/catalog
307,万界天尊,血红,玄幻,341.1万字,完结,天为何物？高高在上，威严莫测，是法则，是戒律，是无情，是冷酷。天意，何也？俯瞰众生，操持风云，褫夺赏罚，随性而为。故，天意不可测，苍天不可近。顺之应之，未必得其利；逆之叛之，福祸却难定。天，禁锢万物如深井，红尘众生如烂泥。有这么一只很单纯、很坚定的井底之蛙，谨慎守护着心头那一点小小的微弱的光，带着一定要咬一块天鹅肉的微薄信念，一步步从红尘烂泥中挣扎而出，一步步走出深不见底的污秽深井。他张开大嘴向心中的天鹅咬上去的时候，不小心将这一方苍天也一口吞下！楚天说，欠钱的，要还钱；欠命的，要偿命。这就是楚天认定的最简单、最坚定的道理。这道理，比天大！,起点中文网,4.2,https://qidian.qpic.cn/qdbimg/349573/1005238666/300,https://m.qidian.com/book/1005238666/catalog
308,伐魔录,东晖,玄幻,288.4万字,连载,伐者，杀也！人持兵戈，斩落敌首，是之为伐！妖魔鬼怪一直是不为世人所知的存在，方当此兵戈杀伐之乱世，他们已然蠢蠢欲动，虻山阒水之妖，血泉残灵之鬼，以颠覆人间之世并欲取而代之的险恶用心开始了对天下的侵蚀，可怖可悸，眼见得锦绣山河翻作血海滔滔，生灵涂炭的修罗场。华夏沦丧岂心甘？妖魔横行怎束手？勇士聚甲，豪杰奋威，人间赳赳虎狼之师，与邪魔恶鬼展开了一场波澜壮阔的杀伐之卷。,起点中文网,6.8,https://qidian.qpic.cn/qdbimg/349573/2330180/300,https://m.qidian.com/book/2330180/catalog
309,侠气逼人,再入江湖,玄幻,166.7万字,完结,异世界如果发生了灵气复苏会怎么样？这里有江湖儿女，这里有妖魔作祟。这里还有武当、少林等千古大派。这里也有恐惧，黑暗，无数灵异。幸运的是，张元随身携带了一个功德面板，里面有一本秘籍，名为九阳神功！只要不断地积累功德，他就可以不断变强，与妖魔战斗。于是乎```张元开始了异世界的好人好事之行。~~~建了群，欢迎各位：912136027,起点中文网,4.4,https://qidian.qpic.cn/qdbimg/349573/1013488561/300,https://m.qidian.com/book/1013488561/catalog
310,超神制卡师,零下九十度,玄幻,340.2万字,连载,这是一只程序员在异世界‘刻光盘’的故事。PS：新书书友群(783084289）,起点中文网,4.4,https://qidian.qpic.cn/qdbimg/349573/1013228494/300,https://m.qidian.com/book/1013228494/catalog
311,野蛮王座,宅猪,玄幻,108.3万字,完结,“如果讲不出道理，那就用拳头打出一个道理！”新书《独步天下》已经上传，书号：1924072，欢迎阅读。推荐作品栏有直通车，或者点击作者空间也可以进入。野蛮王座书友群：3604527382481924,起点中文网,7.1,https://qidian.qpic.cn/qdbimg/349573/1455586/300,https://m.qidian.com/book/1455586/catalog
312,带着农场混异界,明宇,玄幻,3710.5万字,连载,他横任他横，我自种我田，若要来惹我，过不了明年。宅男赵海带着QQ农场穿越到了异界，附身到了一个落迫的小贵族身上，他的封地是一片种不出东西的黑土地，而最主要的是，他还有一个无比强势的未婚妻，他的未婚妻竟然是一个公国的继承人，未来的女大公！最最主要的是，他还是一个魔武废材，不能学魔法，不能学武技，废的十分彻底。我不能学魔法，但是我有农场，你敢攻打我？我放虫子吃光你的军粮，吃光你的庄稼，把你们的水源都下上杀虫剂，除草剂，给你的地上都种上杂草，我看你还敢来攻打我。什么？你要请杀手来暗杀我？嘿嘿嘿，我躲在自己农场的小屋里，看你怎么打我，等你走了，我就让你们国家的粮食绝产，到时候所有人都会起来造你的反，看你还敢来杀我。切看一个有点腹黑的宅男，怎么用他的QQ农场，在那个剑与魔法的世界里，成为让天下所有人一听到都会做恶梦的存在。,起点中文网,5.3,https://qidian.qpic.cn/qdbimg/349573/1867311/300,https://m.qidian.com/book/1867311/catalog
313,我只想安静地打游戏,十二翼黑暗炽天使,玄幻,366.6万字,连载,一滴血一条命，别人打游戏爆肝，我打游戏爆血。次元风暴降临，地球四处出现了大量的异次元领域，仙、佛、恶魔、天使、精灵等各种异次元生物降临地球。而那些神秘的异次元领域，却都变成了手机游戏副本，别人拿命去冒险，我却拼命打游戏。已完本小说《超级神基因》730万《剑装》300万《神品道圣》160万。,起点中文网,3.9,https://qidian.qpic.cn/qdbimg/349573/1015057768/300,https://m.qidian.com/book/1015057768/catalog
314,我才不是武祖传人,嫌疑人小X,玄幻,50.2万字,连载,总有人说宁宣是武祖的传人，宁宣从来摇头否认。“什么武祖，老谢只是我的朋友。”他说，“我们公平而对等，我不是他弟子，他不是我老师。”从长剑中悠悠然升起烟云，传来驳斥的声音，“别朋友了，真不熟，只是老乡而已。但你有句话说的没错，我们的确公平而对等——我要夺舍你，你要杀死我。”,起点中文网,5.5,https://qidian.qpic.cn/qdbimg/349573/1024885729/300,https://m.qidian.com/book/1024885729/catalog
315,幽魂白骨幡,默幽,玄幻,79.8万字,完结,幽魂白骨幡降临异世界，落魄老实少年融合幽魂白骨幡残留修士记忆，从此变态……老题材，不过，希望写出一点新的东西……75560128，幽魂白骨幡群。,起点中文网,6.9,https://qidian.qpic.cn/qdbimg/349573/3451249/300,https://m.qidian.com/book/3451249/catalog
316,御风,能猫,玄幻,86.3万字,完结,【起点第四编辑组签约作品】..残兵存败亦如末山路倒====================================我是瞌睡的分隔线====================================.本书书友群号32810051。,起点中文网,7.1,https://qidian.qpic.cn/qdbimg/349573/154300/300,http://book.qidian.com/info/154300
317,域外天魔搞事日记,帷间客,玄幻,194万字,连载,"“你渴望力量吗？” “no,thanks,我渴望搞事。” 万千世界中，混乱之极致名为混乱魔域，异界生灵在此迎来第一次死亡后，会得到无尽的力量，进入永劫之轮回，成为万世之灾祸。 现世少年秦渊因为装逼惨遭强行穿越，成为了混乱魔域的一员，又在失败的召唤中穿入一个层层修炼、等级森严的残酷玄幻世界。 作为一个没有等级的魔，他压力很大；作为魔中萌新，他压力更大。 但是，没有关系，因为，深渊本身，无所畏惧。",酷匠网,4.9,https://s.kjcdn.com/i/pubwmrs/6o/8w/14op1.jpg,http://www.kujiang.com/book/36188
318,厉害了我的原始人,竹刺无锋,玄幻,217万字,连载,这是一个由石炭纪的巨虫、侏罗纪的恐龙、古近纪的凶兽交织共存的，凶残度爆表的史前世界。在这片恢弘瑰丽的史前世界中，人类不再位于食物链顶端，反而在各种猛兽凶虫的夹缝里艰难求存……原始社会种田加冒险文,起点中文网,5.5,https://qidian.qpic.cn/qdbimg/349573/1010541675/300,https://m.qidian.com/book/1010541675/catalog
319,青帝,Deathstate,玄幻,209.2万字,完结,人道崩坏，仙界无踪。天生贵胄，沦为草芥。九州破碎，杀劫缠身已完本近五百万字作品《湛蓝徽章》信誉保证，放心收藏。官方群【一】青帝宫：172360217（11群，VIP读者请加）官方群【二】红莲寺：126227139（铁杆群，暂不开放，勿加）官方群【三】楚王祠：145368628（交流群，作者也会出现）官方群【四】徽章众：70467850(老读者群，人数较多，欢迎聊天）以上官方群请勿重复加入，发现重复者将移除,起点中文网,6.4,https://qidian.qpic.cn/qdbimg/349573/2092385/300,https://m.qidian.com/book/2092385/catalog
320,无上真魔,皇甫奇,玄幻,82.6万字,完结,一个生活在现代，读古圣贤之书，养浩然之气，追求内心世界的现代少年，在一次回老家祭祖的过程中，遇到传说中的豺狼拜月，无意闯入其中，进入到了另一个陌生的世界。在这个世界中，少年发现许多与现代世界的神话传说息息相关的秘密——这是一个神话之源的世界。林君玄无意中得到剑公子死前赠送的四大凶剑诛、戮、陷、绝，这与明朝许仲琳所著《封神演义》的诛仙四剑又有何关系？许仲琳又是何许人也？一卷《道法正藏》让林君玄明悟道境之途，一卷《奇门遁甲》让少年游刃有余的周旋于这个世界的众高手之间。即使道法再高的真人，也要遇上天人五衰，终难逃一死。唯有臻至“三花聚顶、五气朝元”之境方可超脱生死！！心有偏执者，即为魔！知‘错’不返，偏执到底者，即为－－－无上真魔！,起点中文网,7.3,https://qidian.qpic.cn/qdbimg/349573/1408443/300,https://m.qidian.com/book/1408443/catalog
321,白骨大圣,咬火,玄幻,138.7万字,连载,【均订过万玄幻精品！】【《白骨大圣》漫画改编版权已卖出！】死人沾地，老狗刨坟，阴人问路，吃活人饭，知道碰上其中一个意味着什么吗？「已有2万均订作品《这里有妖气》」「《这里有妖气》漫画改编版权已卖出」「《这里有妖气》漫画已上线，可在腾讯动漫、起点漫画、b站漫画阅读」V群验证群：609033668（需粉丝值大于2000）：书友①群：608548874；（已被祭天）书友②群：760859432；（少量空位）书友③群：633795166。（少量空位）,起点中文网,5.4,https://qidian.qpic.cn/qdbimg/349573/1020884972/300,https://m.qidian.com/book/1020884972/catalog
322,灭尽尘埃,奥尔良烤鲟鱼堡,玄幻,170.8万字,连载,生命是一粒卑微的尘埃，随时会被掸灭毁烬，湮没飘零。而人生却是一场盛大的修行，必将执着往上，奋斗不息。这是英雄倍（辈）出的时代，而他们终将被征服，化作历史的尘埃。写心中的玄幻故事。P.S.这是一个很嗨的，清洁工成长奋斗史。一群：181980859二群：1900923285534592474614306,起点中文网,5.8,https://qidian.qpic.cn/qdbimg/349573/2145073/300,https://m.qidian.com/book/2145073/catalog
323,仙之雇佣军,写字板,玄幻,243.7万字,完结,一群被神挑选的死人，为了复活而成为神的雇佣军，为了各自的信仰，展开激烈变强竞争。主角驾驭无影飞剑，指挥百万金蚕蛊，麾下带领一群美女，开着亚特兰蒂斯人的宇宙战舰，为了华夏神仙一脉，毅然踏上了横扫银河系的征战之路。当真是遇神杀神，遇魔斩魔，所向披靡！,起点中文网,6.3,https://qidian.qpic.cn/qdbimg/349573/154823/300,https://m.qidian.com/book/154823/catalog
324,武炼巅峰,莫默,玄幻,1773.6万字,连载,武之巅峰，是孤独，是寂寞，是漫漫求索，是高处不胜寒逆境中成长，绝地里求生，不屈不饶，才能堪破武之极道。凌霄阁试炼弟子兼扫地小厮杨开偶获一本无字黑书，从此踏上漫漫武道。,起点中文网,4.8,https://qidian.qpic.cn/qdbimg/349573/2494758/300,https://m.qidian.com/book/2494758/catalog
325,剑仙三千万,乘风御剑,玄幻,201.6万字,完结,“天龙道宗乃九耀星八大无上大宗之一，本座更为天龙道宗道子，你得罪了本座，只要本座一声令下，剑仙如云……”“轰！”秦林叶对准九耀星隔空一拳。拳劲蕴含的力量洞穿大气层，犹如一颗直径数十公里的致密星以上千公里的秒速度狠狠撞击地面。大地融化、星核粉碎。烈焰和岩浆席卷起的浪潮以超音速源源不断朝四面八方扩散，地壳表面的山川、河流、森林，被完全剥离，撞击抛起的尘埃与岩石直接飞向了大气层，并在下一刻……咔嚓。毁灭性的力量贯穿星辰，掠过星空，消失在无尽深幽。星球崩裂、炸散！粉碎！犹如一朵闪耀在星海中的烟花。“你刚才说什么，剑仙如云下面呢？我好像没有听清楚。”秦林叶举着拳，看向这位天龙道宗道子。,起点中文网,5.1,https://qidian.qpic.cn/qdbimg/349573/1022354901/300,https://m.qidian.com/book/1022354901/catalog
326,天域苍穹,风凌天下,玄幻,505万字,连载,笑尽天下英雄，宇内我为君主！ 万水千山，以我为尊；八荒六合，唯我称雄！ 我欲舞风云，凌天下，踏天域，登苍穹！谁可争锋？！ 诸君可愿陪我，并肩凌天下，琼霄风云舞，征战这天域苍穹？！ ………… 天域苍穹官方群一：376497379 天域苍穹官方群二：374474820,创世中文网,3.2,http://wfqqreader.3g.qq.com/cover/867/456867/t5_456867.jpg,http://chuangshi.qq.com/bk/ly/456867.html
327,天苍黄,有时糊涂,玄幻,290.6万字,连载,天地不仁以万物为刍狗！圣人不仁以百姓为刍狗！ 死里逃生，脱胎换骨。仇人，藏于九地之下！江湖，朝堂，何处寻觅？ 江湖隐士，遁世仙门，门阀世家，纷纷粉墨登场，数千年前的隐秘被揭开。 天道何在！爱恨情仇，如何选择？ ......... 这其实是个复仇的故事，发生在山雨欲来的大晋，搅动风雨的柳寒，则多了一段异世的记忆。 糊涂书友群：群1：50219094，群2：201108312,创世中文网,4.9,http://wfqqreader.3g.qq.com/cover/320/508320/t5_508320.jpg,http://chuangshi.qq.com/bk/ly/508320.html
328,武煌焚天,十二龙骑,玄幻,337.4万字,完结,吾之掌中，紧握煌煌武功；吾之脚下，踏定燎天之火； 昊日东升，凤凰不灭，焚尽天下，浴火重生！,17k小说网,4.3,https://cdn.static.17k.com/book/600x800/31/09/1380931.jpg-600x800?v=0,http://www.17k.com/book/1380931.html
329,超神道术,当年烟火,玄幻,259万字,完结,灵你感觉自己力量不足，力量+1，你修炼了金钟罩，武功等级+1，你捡到了一本道经，悟性+1，你的对手力大无穷，金钟罩大圆满，你将金钟罩，铁布衫，十三横练全部+1，练成了金刚不坏神功，对手刀砍不动，崩溃欲绝。……已有一本两百万字完本老书《极道飞升》，人品保证，放心阅读！！书友群：181938106VIP群：768064901，弟子以上粉丝值可进。,起点中文网,4.4,https://qidian.qpic.cn/qdbimg/349573/1014952645/300,https://m.qidian.com/book/1014952645/catalog
330,主神的黑店,流年往事,玄幻,184.5万字,连载,楚河获得了一个残破的主神，开启了自己的黑店生涯。“主神，我死后请把我的骨灰洒在海里。”“为什么？”“哪怕我死了也要浪起来。”这是一个贸易诸天的故事，一个黑心商人的浪荡之路。生死看淡，不服就干！！！------ps：已有完本精品《超时空穿越》，人品保证，放心阅读。qq群：627622873,起点中文网,4.1,https://qidian.qpic.cn/qdbimg/349573/1007386189/300,https://m.qidian.com/book/1007386189/catalog
