,title,author,sort,count,status,detail,site,rank1,cover,url1
584,无上崛起,宝石猫,玄幻,452.3万字,完结,紫日当空，天地巨变，皓月有缺，虚空相连！经历了一场被称为大破灭灾难的地球，大部分的生物直接死去，人类在最后的安全区域苦苦坚守，可是他们面对的，不只是变异的凶兽，还有那随时都能破开空间壁垒，进入地球的巨大源兽！生长于危难之间的少年罗云阳，得属性调节器，从而走上了一条崛起之路！无上崛起群：80885001,起点中文网,3.1,https://qidian.qpic.cn/qdbimg/349573/1010000699/300,https://m.qidian.com/book/1010000699/catalog
585,担山,卸甲老卒,玄幻,33.8万字,连载,命运，缥缈不可见，却将世人玩弄于股掌之间。庙堂与江湖，明争与暗斗，算计与厮杀。都在为一己之利而生死相搏。而这残破的万里河山，又有谁来肩挑重担?【感谢阅文书评团提供书评支持】读者交流群（569187424）,起点中文网,6.7,https://qidian.qpic.cn/qdbimg/349573/1001810976/300,https://m.qidian.com/book/1001810976/catalog
586,我可以兑换悟性,岳麓山山主,玄幻,359.5万字,完结,“恭喜宿主，斩杀邪神，获得百万善功，善功可兑换悟性时间。”穿越神灵道法世界，成为小小捕快。沈追发现自己每击杀一个头顶罪恶值的人，就会获得善功，更能兑换一次次悟性时间！,起点中文网,4.1,https://qidian.qpic.cn/qdbimg/349573/1015313577/300,https://m.qidian.com/book/1015313577/catalog
587,我在魔法世界开创互联网时代,白天太白,玄幻,109.4万字,连载,神的力量来自众生。追随者越多，神的力量越强大！意外获得契约神格的余生安，嗤笑道：“嘁，别整那些虚头巴脑，不就是互联网抢夺用户流量那一套吗？”看我：社交平台收割流量；短视频用户下沉；知识问答吸纳铁粉；异界直播转化信徒；电商利益拉拢所有人；再来一波第四天灾，平推尔等（众神）歪门邪道！……种田+幕后流（群：610034508）,起点中文网,4.1,https://qidian.qpic.cn/qdbimg/349573/1023099668/300,https://m.qidian.com/book/1023099668/catalog
588,魔师,瑞根,玄幻,45.3万字,完结,冷眼睥睨皆乌有，一剑光寒十四州！崩坏将倾的天道乱世，且看一个懵懂独行的少年如何谱写一段铿锵热血的传奇史诗！充满生活气息的修仙画卷，波谲云诡的生存情仇，激荡昂扬的铁血恩怨，再现一个真实的东土玄幻世界。已完成四本书，一千六百万字，《江山美人志》、《魔运苍茫》、《异时空之风华游猎》、《弄潮》，老瑞出品，质量保证，人品保证！,起点中文网,6.3,https://qidian.qpic.cn/qdbimg/349573/2111340/300,http://book.qidian.com/info/2111340
589,妖弓,明月夜色,玄幻,237.2万字,完结,这是一个属于妖弓手的故事。一个另类的职业，一个另类的传奇……他没有高人一等的天赋，他没有震慑人心的霸王风范，他所拥有的只是一颗与众不同的妖丹。天才？我不是天才，因为我是天才终结者，各位天才们，努力修炼吧，因为只有你们努力修炼，我才能更快的成长……（2016新书《箭魔》已经在起点上传，还请各位多多捧场。）,起点中文网,4.9,https://qidian.qpic.cn/qdbimg/349573/1965156/300,https://m.qidian.com/book/1965156/catalog
590,踏天争仙,三生万物,玄幻,0字,完结,群雄逐鹿，仙道争锋，天若阻我，我便踏天而行！众生渺渺，皆是苦难河上的纸做小舟，风来浪打，飘摇孤苦，方荡要打造一艘打不沉的巨舰，扬帆起航，迎着朝阳乘风破浪，逆天而上，直入星河。———————————————三生的QQ群   踏天争仙群 207274330（最新推荐加入） 杀神群 65061774   人道洪炉 12213790 天道十三层 182875680,纵横中文网,5.6,http://static.zongheng.com/upload/cover/37/1c/371ca24131f09cffd11ad0656c908dcc.jpeg,http://book.zongheng.com/book/437719.html
591,全能魔法师,离火加农炮,玄幻,268.1万字,完结,带着ipad穿越异界的叶垂：谁告诉你我是魔导师的，你见过魔导师用ipad怼人的么？魔咒剑技很珍贵？我都是直接从app商店上下载的。古墓秘境危险丛生？那冒险的时候开地图导航就可以了。更不用说杀毒软件可以抵御攻击，浏览器可以登录他人意识，电话可以跟人远程传讯，还可以发条微信诅咒你。甚至电影人物都可以当作英灵召唤出来，三国武将和超级英雄站一起就问你怕不怕？跟人打架的时候再来一首激昂燃曲增加全属性buff，跟你说，在我的bgm中我就是无敌的。（以上是新书带着ipad闯异界的简介，是全能魔法师的续集，欢迎大家关注~~同一个马甲发书~~）,起点中文网,5.6,https://qidian.qpic.cn/qdbimg/349573/3594977/300,https://m.qidian.com/book/3594977/catalog
592,风临异世,蓝领笑笑生,玄幻,168.5万字,完结,一个现代不为人知的天才，意外死亡后穿越到异世成了一个游魂，却在机缘之下找了一个超级的纨绔子弟做自己的替身！用天才的大脑来练习斗气，用现代的记忆来运用武技，用特殊的方式来释放魔法，用脑中的技术来打造兵器！！,起点中文网,5.0,https://qidian.qpic.cn/qdbimg/349573/116406/300,https://m.qidian.com/book/116406/catalog
593,龙王戒,李白不白,玄幻,116.7万字,完结,偶然得到一枚可以任意穿越小说世界的龙王戒指，不爽高中生贾里玉就此开启得意人生。纵马水浒三国，谈笑用兵，结交英雄好汉；梦游红楼警幻，增删判词，金陵十二钗命运改变。五百年前，菩提树下，七十二变。五百年后，大圣归来，天外飞仙。,起点中文网,4.5,https://qidian.qpic.cn/qdbimg/349573/1003358385/300,https://m.qidian.com/book/1003358385/catalog
594,神话行者,三九蝎,玄幻,28.1万字,完结,一幅幅壁画，一段段传说。周处除害，河神问斧，哪吒闹海，羿射九日……宋渊一步步行于神话传说中，走向长生不朽！……纯阳飞剑千里杀人，三昧真火焚山煮海！乾坤圈下万宝崩碎，射日弓出烈阳陨落！“你以为这些讲得是神话传说里的人物？不，这些其实说得都是我的事迹……”——青墟山太上长老，妖族克星，大气运者，多宝天尊，宋渊。,起点中文网,5.5,https://qidian.qpic.cn/qdbimg/349573/1020871315/300,https://m.qidian.com/book/1020871315/catalog
595,我在诸夏当大王,六戏,玄幻,236.1万字,完结,新书《大能合伙人》已发，感兴趣的快来看看！这是一个绝地天通后的山海神话世界，人间与天界两隔；太昊、黄帝、炎帝、帝俊、少昊......各方天帝；木神句芒、火神祝融、土神后土、海神禺强各路大神；众神尽皆飞升，留下一个天子分封四方、诸侯开疆拓土的诸夏天朝：有瑞兽当康，现则大穰，各国翘首以盼；有灾疫蜚兽出，天下瘟疫，人心惶惶；有帝女旱魃，赤地千里，人厌神嫌；有女娲之肠处栗广之野，横道而处；姚云成为一方诸侯世子，开局两条龙；是问鼎至尊，统御四海八荒还是败光一个国家，回老家享清福？,起点中文网,4.8,https://qidian.qpic.cn/qdbimg/349573/1013637116/300,https://m.qidian.com/book/1013637116/catalog
596,最大权限,肥鱼马甲,玄幻,102.9万字,连载,制作游戏成功的林陨意外猝死，穿越到自己制作的游戏世界，结果拥有了这个世界的最大权限！最大权限书友群：305908807,起点中文网,4.7,https://qidian.qpic.cn/qdbimg/349573/1007020918/300,https://m.qidian.com/book/1007020918/catalog
597,我只想安静地肝成就,剑飞春风上,玄幻,22.4万字,完结,这是一个长满了诡异秘密的世界。阴冷的影子，日夜在峡谷徘徊；密林中的道观，供台下堆满了森白的人骨；表面宁静的城镇，却存在着各式各样的古怪......面对可怕的未知，顾云栖埋头苦干，坚持做着别人口中“脑子有病”的事情，缘于他是一个没有人懂的成就党。[对180斤的大汉举高高XX次，解锁成就‘练气初识’，成为世间唯一炼气士。][气得肝疼十次，解锁成就‘肝中生气’，获得先天真气一缕。][雕刻梦中机枪模型一百次，解锁成就‘都是你的形状’，获得‘灵火铳(加特林版)’x1]......,起点中文网,4.6,https://qidian.qpic.cn/qdbimg/349573/1016534928/300,https://m.qidian.com/book/1016534928/catalog
598,烈血战神,干枯大地,玄幻,205.8万字,连载,他初出茅庐，却被浮屠教追杀，成为全天下赏格最高的通缉犯。 他本心善良，却遭小人诬陷，阴差阳错地当上了四大之首。 在最初踏入西原堡垒的那天，江遥绝对没有想到，自己将来会以这样的方式，名动天下。 官方群号：583347127,创世中文网,5.9,http://wfqqreader.3g.qq.com/cover/872/307872/t5_307872.jpg,http://chuangshi.qq.com/bk/ly/307872.html
599,气冲星河,犁天,玄幻,324.1万字,完结,"中国古武界史上最年轻的大宗师武星河,重生在异世界一个下等贵族少年身上。再次开启他武道追求的颠峰之路.不依阿权贵，不妥协豪门,哪怕你火海焚身，自有两只铁拳打出一片清朗乾坤；哪怕你刀山盖顶，自有一口真气喷上九霄气冲星河!身似蛟龙，到哪都能翻江倒海;心如猛虎，何处不可傲啸山林欺山赶海,不参仙佛,不拜鬼神,未惧这处处地网天罗轮回十世,上凌九霄,下踏黄泉,只为那一刻气冲星河",起点中文网,5.4,https://qidian.qpic.cn/qdbimg/349573/1712249/300,https://m.qidian.com/book/1712249/catalog
600,三界独尊,犁天,玄幻,686.7万字,完结,天帝之子江尘，转生在一个被人欺凌的诸侯少年身上，从此踏上一段轰杀各种天才的逆袭之路。 在江尘面前，谁也没资格自称天才，因为，没有哪一个天才，能比天帝之子更懂天。 天才？顺我者天，逆我者渣！,创世中文网,4.2,http://wfqqreader.3g.qq.com/cover/657/319657/t5_319657.jpg,http://chuangshi.qq.com/bk/ly/319657.html
601,挂机死神就能变强,切开的柠檬,玄幻,120.1万字,完结,武者、元素使、强化人、改造者......这个世界表面和平安宁，底下却是暗潮汹涌，超凡力量层出不穷，危险遍布。作为一个普通人，林黎川唯一能依靠的只有金手指死神放置小游戏，每天24小时勤勤恳恳修（gua）炼（ji），什么时候有个十把八把斩魄刀，再加上假面，就可以出去浪了。噢，差点忘了，还有崩玉。书友群：959255191，欢迎来聊。,起点中文网,3.9,https://qidian.qpic.cn/qdbimg/349573/1019251056/300,https://m.qidian.com/book/1019251056/catalog
602,玄界旅行社,高森,玄幻,222.8万字,连载,找工作失败，通宵狂饮，结果却误入专门服务于修士的玄界旅行社！不过，这位前辈怎么看上去有些怪怪的，你怎么会有猫的耳朵呢？等一下，你为什么还会对猫薄荷这么敏感呢？感谢崔莲支援的后援团：337435371,起点中文网,4.8,https://qidian.qpic.cn/qdbimg/349573/1009713135/300,https://m.qidian.com/book/1009713135/catalog
603,至高神权,祈言誓约,玄幻,98.2万字,完结,这是一个误堕黑暗的纯洁少年在重新寻求光明的道路上艰苦奋斗的励志故事……,起点中文网,6.5,https://qidian.qpic.cn/qdbimg/349573/2492820/300,http://book.qidian.com/info/2492820
604,林家有女初修仙,宝妆成,玄幻,169万字,完结,传家宝里的小空间，浅浅水泉，方寸药田。学历，青春，家境通通没有的大龄三无女林洛然，在惨被劈腿后人生来了个大逆转。只想种点人参娃灵芝妹改善家境的林洛然，此时还不知道，自己会成为地球最后一个女修。地球修真一脉断绝千年，林洛然上穷碧落下黄泉，不过是为求得都市中一缕仙缘。林家有女初修仙，至于爱情……帅哥，你懂修真咩？——《林家》寻求简体、繁体出版，有意者请留言联系作者。,纵横中文网,7.8,http://static.zongheng.com/upload/cover/2011/04/1303973061658.jpg,http://book.zongheng.com/book/94311.html
605,纵剑天下,乘风御剑,玄幻,188.8万字,完结,这是一个高手辈出，波澜壮阔的时代。这是一个百圣争锋，万剑争鸣的时代。无生剑道、无缺剑道、无败剑道、无情剑道、极情剑道、无我剑道、唯我剑道……在这个被一尊剑神洒满剑道种子的大陆上，无数的剑道天才，横空出世，相竞第一。王庭！一个前世为剑道奉献了一生的人，降临到了这个世界！……继《剑噬天下》、《无上真身》、《星神祭》、《求败》、《一剑凌尘》后的第六本小说，诚邀诸位共品剑修盛宴。本书书友群：244200264！本书订阅群：87966951！纵剑剑楼群：51211792！,起点中文网,5.4,https://qidian.qpic.cn/qdbimg/349573/2492814/300,https://m.qidian.com/book/2492814/catalog
606,霸天雷神,萧潜,玄幻,303万字,完结,我是萧潜，我为霸天雷神代言——这绝对是一本好书。兄弟们可以来加我新建的Q群122075557，好些年没见大家了，可以一起聊聊,纵横中文网,5.9,http://static.zongheng.com/upload/cover/2014/04/1398393421130.jpg,http://book.zongheng.com/book/357799.html
607,我能帮你加点,古羲,玄幻,52.7万字,完结,这是一个有武道、神廷、巨城、异魔、剑种……的神秘世界。————,起点中文网,3.5,https://qidian.qpic.cn/qdbimg/349573/1013965065/300,https://m.qidian.com/book/1013965065/catalog
608,对着剑说,兰帝魅晨,玄幻,149.2万字,完结,传说开天辟地之力化作无数部分，散落在天地间，被称为混沌碎片，得其力量多者既为武王！武王可令逝者死而复生，让活者永生不灭。只要世上还有一个人记得，就能死而复生！这就是武王拥有的力量。天下众生，皆为大小武王而战，只求得赐那永生不灭的殊荣。李天照本来也以为他追求的是这份殊荣，某天他突然发现，他要的是拥有这种力量……,起点中文网,4.7,https://qidian.qpic.cn/qdbimg/349573/1015483557/300,http://book.qidian.com/info/1015483557
609,变身之女侠时代,龙之宫,玄幻,229万字,完结,石青山穿越成了石青珊，不仅变为女子，更是成为了寡妇，武林第一的少侠丈夫才拜完堂就被武魔所杀。,起点中文网,5.8,https://qidian.qpic.cn/qdbimg/349573/1011447561/300,https://m.qidian.com/book/1011447561/catalog
610,万法梵医,相思洗红豆,玄幻,195.2万字,完结,身为灭疫士，当手握斩医刀，斩尽天下疫病，砍翻日月星辰！……从明天起，做灭疫士，斩疫病，救人命，泡尽天下美女，从明天起，只关心战绩和排位，我有一家医院，只要女医生和护士，全穿制服和高跟！什么？你不同意，腌进福尔马林做标本！……有株稻草人，喜欢顺手牵草，没事吐口水，有个粉雕玉琢小萝莉，却是暴力连击，爱把鲜血作画！少年卫梵，抱盆栽，佩名刀，走天下，心有不顺，便将这苍穹捅个窟窿！,起点中文网,4.0,https://qidian.qpic.cn/qdbimg/349573/1004050071/300,http://book.qidian.com/info/1004050071
611,万道剑尊,打死都要钱,玄幻,1104万字,连载,少年得大天造化诀，在逆境中崛起，在绝境中争得一线生机，踏天道，破苍穹，剑指神霄，战遍九天十地！,创世中文网,4.2,https://wfqqreader-1252317822.image.myqcloud.com/cover/720/1001294720/b_1001294720.jpg,http://chuangshi.qq.com/bk/ly/1001294720.html
612,我不想当妖皇的日子,剪水II,玄幻,153.4万字,完结,【无敌文】叮！您获得了天赋【神悟】，可领悟天地，从天地里获得力量。您发现自己每天什么都不用做，就可以获得所在区域的一颗随机“技能珠”。叮！您定居在了王都，每天躺着，却越来越强。您住了16年，王都所有的功法您已经完全掌握。…您开始四处旅行，却无时无刻不在变强。…终于有一天。您发现自己身份不凡。您手下的大妖开始密谋屠仙灭佛。您被迫卷入战争。唔…也许是时候去太上仙宫住上几天了。叮！您已经掌握大仙帝的技能。您已经超越了大仙帝。您已经无敌。PS:正版书友群：715538233,起点中文网,3.2,https://qidian.qpic.cn/qdbimg/349573/1016027977/300,https://m.qidian.com/book/1016027977/catalog
613,造化之王,猪三不,玄幻,984.6万字,完结,一夜之间，少年叶真突然发现自己拥有了一项奇异的能力！山间虫兽那无意义的叫声，传入他耳中，就变得不太一样。老鼠兄弟吱吱的叫着：兄弟，后山里能让我们体型增长数十倍的宝贝快滴落了，快走！一群蚊子在叽叽喳喳：那两个家伙又来了，兄弟们，快上，吸个饱！一只云翼幼虎面对叶真发出一声又一声慑人心魄的虎啸：妈妈不在家，别过来，再过来吃了你！一切，都因此改变！猪三最新的新书《基因大时代》已经发布，兄弟姐妹们收藏推荐走一波呐。嫌新书字少的兄弟，可以宰杀猪三的万订精品老书《掌御星辰》。最后，老猪向兄弟们伸蹄子啦！交流区，VIP（489-110-740，需订阅验证）普通区（481-325-504。）,起点中文网,4.6,https://qidian.qpic.cn/qdbimg/349573/3200489/300,https://m.qidian.com/book/3200489/catalog
614,诸天归一,酒池醉,玄幻,59.5万字,连载,（原书名，《我杀死了自己》）完成遗愿：修炼天赋基础倍数+1，获得过目不忘完成遗愿：修炼天赋基础倍数+1，获得天生神力完成遗愿：修炼天赋基础倍数+1，获得元素之心完成遗愿：修炼天赋基础倍数+1，获得机械掌控击杀自己:修炼天赋基础倍数+1，获得太阴圣体......完成平行世界自己的遗愿或者强行击杀平行世界的自己，能使自身的天赋无限叠加。当所有世界的我合为一体，我就是全知全能的至高唯一！——————公布一个读者群771649881,起点中文网,4.5,https://qidian.qpic.cn/qdbimg/349573/1015222288/300,https://m.qidian.com/book/1015222288/catalog
615,科技大仙宗,大梦游家,玄幻,529万字,连载,在一缕残魂的忽悠下，满怀希望的叶赞，来到了这个修仙文明的世界。然而，以为能够罩着自己的大仙宗，如今只是谁都能来欺负的落魄宗门。那缕自称道祖的残魂，也找不到了重塑肉身的精血。“好在，我还有科技！”想要历练？SOEASY！只要开个网游。想做天才？SOEASY！只要得到天才的基因。想要一览天下？SOEASY！只要放个卫星。炼丹，炼器，符箓，阵法，在科技的辅助下，一切都是那么的SOEASY！科技不是万能的，但科技让生活更美好，于是叶赞在不美好的仇人家里，种起了一朵朵的蘑菇。科技可以强国，科技也可以强宗，看一个落魄宗门，在叶赞的经营下，如何成为一个科技大仙宗。,起点中文网,5.0,https://qidian.qpic.cn/qdbimg/349573/1003488962/300,https://m.qidian.com/book/1003488962/catalog
616,我的孝心变质了,打死不鸽,玄幻,71.3万字,连载,穿越真灵大陆，萧然成为一代女尊伶舟月的亲传弟子，绑定“最强孝心系统”的他，只要给师尊尽孝心就能变强。端茶送水，捶腿揉肩，他用美食仙酿腐蚀师尊的肉身，用小说漫画腐蚀她的灵魂，在师尊身上没日没夜的薅羊毛！终于有一天，这位本想占徒弟便宜的漂亮女师尊，发现自己反被徒弟薅尽羊毛，红着脸骂他：“孽徒，你的孝心变质了！”【另类狗粮文，非舔；另有五千均完本老书《女大三千位列仙班》，无敌狗粮文，书荒可看。】,起点中文网,5.4,https://qidian.qpic.cn/qdbimg/349573/1022455371/300,https://m.qidian.com/book/1022455371/catalog
617,圣皇,枫落忆痕,玄幻,463.2万字,完结,问下天下，谁人不死，万古大帝，绝代圣皇，谋求长生，手段遮天依旧难夺造化，化为黄土。长生之谜自古以来让人追寻。 叶辰，地球大龄青年一枚，　神奇来到长生大陆，莫名其妙变成十几岁的少年，绝世体质遭天地大道所不容，降下天罚，封印了丹田，被称为天罚废体。 为了生存，为了尊严，为了解开心中的谜团，他毅然走上艰难无比的修炼路，誓死不回头，胸口印记，体内青铜鼎，助他开启肉身宝藏，攻防无双，混沌仙体霸绝寰宇！一步一步解开长生之谜。 3月20---4月20日，枫落的新书《无上神道》开启限时免费阅读，朋友们不要错过这个好机会，速速去围观吧。,17k小说网,4.1,https://cdn.static.17k.com/book/600x800/86/43/314386.jpg-600x800?v=1565706377000,http://www.17k.com/book/314386.html
618,奥比岛,奥比椰,玄幻,109.8万字,完结,炼妖淬魔葫，被收入其中者都会变成傀儡。这些傀儡虽然保留了本体意识，但身体的第一控制权已然属于炼妖淬魔葫的主人。夜闯奥比岛皇宫，劫掠了皇宫至宝炼妖淬魔葫的小侯爷唐逍，从此走上了一条奇特的修武之路。控制对手，从此打遍天下；控制卖家，从此白吃白喝白拿；控制朝廷命官，从此官途一路高升；嘿嘿，该干啥就干啥呗！大手一伸抓抓抓！天下之人尽皆傀儡，谁也别想逃出本少爷的魔爪！.武者等级划分：人元、地元、天元。这是一个武者为尊的世界，且看唐逍如何横征暴敛、欺男霸女，最终成长为一个一手遮天的混世大魔王。,起点中文网,3.3,https://qidian.qpic.cn/qdbimg/349573/1960257/300,http://book.qidian.com/info/1960257
619,异世之王者无双,蓝领笑笑生,玄幻,142.1万字,完结,假如你有一双可以控制他人的眼睛，那你就可以掌控天下，成为一个无双王者！！—————————————————————————完本老书，《风临异世》书号：116406，一百七十万字，大家有时间去看看！,起点中文网,6.7,https://qidian.qpic.cn/qdbimg/349573/1011953/300,https://m.qidian.com/book/1011953/catalog
620,读档修仙,真名封印,玄幻,422.9万字,完结,【读档流】修仙不易，更别说一个普通的凡人，想要在这个命如草芥，生死由天的世界修行。在这个人吃人的疯狂世界，卓不凡唯一能做的，就只有不断地将自己的修仙生涯存档，因为他不知道自己什么时候会莫名其妙的死亡。及时存档，然后死亡读档。究竟是将残酷的命运再经历一次，还是将悲惨的结局重新改写。——————新书《超神封魔师》已经发布，还请新老书友，多多支持！谢谢！！,起点中文网,3.4,https://qidian.qpic.cn/qdbimg/349573/1010695671/300,https://m.qidian.com/book/1010695671/catalog
621,精怪登录器,文字旁,玄幻,123.4万字,完结,一百年前，随着第一位武者强势登场，世界为之震动，从此进入了众星璀璨的修炼新时代。某一天，秦鸣收到了一份幸运大奖，得到一个登录器，从此在另外一个奇异的世界来去自如。化身成龙，吞云吐雾。化身成凤，焚江煮海。化身神猿，威震苍穹。【叮！恭喜完成任务，和小神龙一起玩耍，获得奖励，神龙一族的祝福！】,起点中文网,4.9,https://qidian.qpic.cn/qdbimg/349573/1014166237/300,https://m.qidian.com/book/1014166237/catalog
622,丹武乾坤,火树嘎嘎,玄幻,360万字,完结,【起点正版】天赋再高，也怕丹药！只要丹药炼得好，没有天才打不倒！隐世丹门的唯一弟子秦凡，最年轻最天才的炼丹师，从灵药贫乏的地球穿越到遍地灵药但炼丹师却极其稀少的武者世界。自此，他的第二人生，华丽地绽放。本书有四十五万字的公众免费章节，诚意十足，读者都说越后面越精彩，首订也已经过万，如觉得前面新意不足，不妨看完再作评论。==========普通Q群：176370881（丫头提供，需看到最新章节，申请栏填主角最新年龄，入群上推荐票截图）,起点中文网,6.0,https://qidian.qpic.cn/qdbimg/349573/2015031/300,http://book.qidian.com/info/2015031
623,我有一把神秘之剑,稀碎玻璃渣,玄幻,206万字,完结,夜幕下的倒影，黑暗中的刀光，舞台上的身影，血泊里的尸体。刀锋起舞，影子杀人。刀下生，刀下死。要么拥抱暗影，要么死于黑暗。......简单来说，就是一个拥有LOL神秘之剑（系统）的主角穿越到异界的刺客（狂战士）故事。,起点中文网,5.2,https://qidian.qpic.cn/qdbimg/349573/1013416041/300,https://m.qidian.com/book/1013416041/catalog
624,小草崛起,北指,玄幻,83.1万字,连载,【2017最火爆新书】重生成为原始世界的一棵杂草，在虫子和各种妖兽之间求生存！进化！进化！再进化……变强！变强！再变强……小草，小草，要崛起！在这蛮荒的时代，四处都是敌人和危险。不是你死，就是我亡！寸草，断天地，斩遍日月星辰！……【倔强小草，励志要成为玄幻小说当中的一股清流！请大家都为自己的书架和书单当中增添一抹绿吧！要想生活过得去，就得头上带点绿呀！】书友群：599637432VIP群：640223177,起点中文网,4.8,https://qidian.qpic.cn/qdbimg/349573/1009489036/300,https://m.qidian.com/book/1009489036/catalog
