,title,author,sort,count,status,detail,site,rank1,cover,url1
872,不会真有人当舔狗吧,白袍飞扬,玄幻,53.7万字,连载,正气凛然的林平得到一个名为‘感化’实则是‘舔狗的系统’。但身为穿越者，怎么能当舔狗呢？林平表示拒绝。可是……【收获好感，你获得XX灵石奖励！】【收获好感，你获得‘顿悟’奖励！】【收获好感，你获得‘万法剑体’奖励！】…………不是我吹牛，这八荒六合，诸天万界，就没有舔不动的圣女！——————————（本书又名：我真不是舔狗）,起点中文网,4.2,https://qidian.qpic.cn/qdbimg/349573/1022657136/300,http://book.qidian.com/info/1022657136
873,道宫继承人,我这有坑,玄幻,62.9万字,连载,三界法，下界幽冥，中界人世间，上界天宫。三界合一，化虚为实，借假修真，可谓人仙。人仙之上可有路？大道可求乎？地仙可成乎？天仙可存乎？,起点中文网,5.9,https://qidian.qpic.cn/qdbimg/349573/1009507529/300,http://book.qidian.com/info/1009507529
874,女神保护人,鹅考,玄幻,56.9万字,完结,传说众神之中最美丽纯洁的女神阿芙伦蒂娜由于受到了大地女神乌娃的诅咒，每隔一千年，便要被封印神力一百天。这一百天之内，她只能成为一个普通的人类。每当这个时候，便是神魔两界夺取阿芙伦蒂娜神格的最好时机。只是因为每次阿芙伦蒂娜在封印神力之前，都在神之空间外围布下防御，所以七千年来，她都平安的渡过了百天危机。但是当第八个百天危机来临时，出现了意外，女神流落到了人间。她遇上了本书的主人公，于是开始了一段搞笑和惊险的浪漫故事……,起点中文网,6.5,https://qidian.qpic.cn/qdbimg/349573/96075/300,https://m.qidian.com/book/96075/catalog
875,圣武称尊,小圆源,玄幻,545.9万字,完结,圣武大陆，武道昌盛。其巅峰处为圣者。时光如浪，淘尽英雄。唯圣者之名，不灭永存。宛如夏夜，万籁俱寂，一颗颗星闪烁，点亮夜空。小小裂岩城内，少年楚天的人生被点亮。自此，他迈向巅峰。武道巅峰是为圣，圣者如星吾独尊。书友群：637585424全订群:732336740,起点中文网,2.6,https://qidian.qpic.cn/qdbimg/349573/1010732487/300,http://book.qidian.com/info/1010732487
876,玄幻之大反派系统,天策校尉,玄幻,214万字,连载,【飞卢小说网独家签约小说：玄幻之大反派系统】重生为玄幻世界的高富帅！天赋超绝！背景深厚！ 但是还没暗爽多久就发现自己已经得罪了这个世界的气运之子。 不过丝毫不慌，你有气运，我有系统！ 大反派系统，掠夺各种气运，成就自身无敌之路！ 飞卢小说网提醒您：本小说及人物纯属虚构，如有雷同，纯属巧合，切勿模仿。,飞卢小说网,4.9,http://img.faloo.com/Novel/498x705/0/281/000281910.jpg,http://b.faloo.com/f/562183.html
877,神霄,泥男,玄幻,135.4万字,连载,神霄，雷帝居所。王鸣，川府大学博士生，专研神霄雷法，为写博士毕业论文回到家乡。轰隆一声：是天诛地灭雷？还是接引雷？王鸣穿越到神霄大陆最偏远的雷国，成为五雷门弟子。百年前，五雷门为护国安民与海妖一战，精英尽殁。百年后，五雷门门前冷落，只剩下门主与徒弟王鸣二人。王鸣得家传无上雷法仙经，破解五雷门弟子容易走火入魔的百年魔咒。没有阴阳学说，没有五行元素说，这竟是一个重武道实践而轻理论的时代。王鸣携先进修炼理念，拥有几乎整部道藏雷法的记忆，继承“前身”遗愿，重振五雷门！炼武道，辟雷池，建雷宫，成就无上雷帝，笑傲神霄。,起点中文网,5.6,https://qidian.qpic.cn/qdbimg/349573/1005188022/300,http://book.qidian.com/info/1005188022
878,不死武尊,妖月夜,玄幻,665.5万字,完结,【完本火书】一个落魄的少年偶得吞天神诀，可吞噬一切天地元气为己用，从此逆天破命，一雪前耻，凭借着神奇的生命武魂，他凝聚不死之身，横扫九天十地，雄霸天下！火热新书【不死武皇】正连载中，认准作者，妖月夜！,创世中文网,4.7,http://wfqqreader.3g.qq.com/cover/991/263991/t5_263991.jpg,http://chuangshi.qq.com/bk/ly/263991.html
879,我有一个加点面板,妖七OL,玄幻,38.3万字,连载,这是一个妖魔乱舞，诡异丛生的危险世界。楼道里徘徊的脚步，荒野中游荡的夜游神，神秘的水坊主人，雪飘百里的雪老人。它们在黑暗中窥视着，将人族当做血食美味。然而对赵令而言，那些旁人惧怕无比的妖魔鬼怪都是被拿来锤的。PS:书友群：1060127137（聊天灌水专用）,起点中文网,4.7,https://qidian.qpic.cn/qdbimg/349573/1018154796/300,https://m.qidian.com/book/1018154796/catalog
880,左道倾天,风凌天下,玄幻,354.5万字,连载,是非谁来判定，功过谁予置评？此生不想规矩，只求随心所欲。天机握在手中，看我飞扬跋扈。————我是左小多，我不走寻常路。VIP全订阅群号：971103262,起点中文网,2.4,https://qidian.qpic.cn/qdbimg/349573/1016460852/300,http://book.qidian.com/info/1016460852
881,三步生莲,失眠的守夜人,玄幻,118.1万字,连载,修武分五步，一步一生莲。柳子衿高举科学的大旗，悍然从第三步开始了修炼。,纵横中文网,4.9,http://static.zongheng.com/upload/cover/34/f1/34f1fabf6fb8ce8526f9bfead1b91308.jpeg,http://book.zongheng.com/book/781230.html
882,魔法师,韦小宝,玄幻,116.9万字,完结,新书《异界铁血商途》已经上传，求点击、收藏、推荐,起点中文网,5.4,https://qidian.qpic.cn/qdbimg/349573/171750/300,https://m.qidian.com/book/171750/catalog
883,武神无敌,秣陵别雪,玄幻,166.3万字,完结,"纵横东方世界莫有能敌者，方能武道称神，是为无敌武神！……东方世界，诸国林立，万千宗门，天才如雨，强者如云！古超,一个普通宗门的外门弟子，只因获得一截神秘小刀，从而使得武道天赋疯狂提升！纵然资质一般，他逆天的武道领悟力，也足以让他与任何绝世天才武道争锋！妖孽般的天赋，注定了他自此以后都不再平凡，终会成为这东方世界唯一的无敌武神！",起点中文网,5.8,https://qidian.qpic.cn/qdbimg/349573/2441849/300,http://book.qidian.com/info/2441849
884,剑王传说,失落叶,玄幻,376.6万字,完结,天心中州起天风，四海英豪逐白鹿。 乱世中，一位少年人王手持神剑，踏万古天路，诛诸天邪魔，铸一段剑王传说！ —————————————————————— ①群577150731 ②群428545141 ③群11267222,17k小说网,3.9,https://cdn.static.17k.com/book/600x800/74/41/1974174.jpg-600x800?v=1565772634000,http://www.17k.com/book/1974174.html
885,我创造了旧日之神,时日月,玄幻,101.9万字,完结,群星归位之时，众神苏醒之日。灵气复苏，天地异变，旧日之神兴起，疯狂的时代就此拉开帷幕。成为了异界的永夜之主，景川心态略微些爆炸。成神哪儿都好，但为什么是这种被全世界所针对的神？！不过幸好可以在异界与地球来回游荡，于是景川在促进灵气复苏的同时，铸造了一个又一个的旧日支配者，威名远扬万界。,起点中文网,3.8,https://qidian.qpic.cn/qdbimg/349573/1017691037/300,https://m.qidian.com/book/1017691037/catalog
886,大地武士,云天空,玄幻,130.2万字,完结,"千招尽算独孤剑兵锋百裂回马枪神力开山挥斧钺技断江河不绝刀只身对阵疯魔棍影惊四海双尖叉皆杀轮回离别钩集气吞天不破戟这是男人的故事,是男人的神话,敬请大家指正.主群:77584152（满）一号群：77584288（满）二号群：73247523(满)三号群:78101035(满)",起点中文网,4.1,https://qidian.qpic.cn/qdbimg/349573/1122027/300,https://m.qidian.com/book/1122027/catalog
887,小战神,平放,玄幻,63万字,太监,一个后世人意外的来到了希腊的神话世界，并且成为了那位悲剧英雄阿基琉斯。特洛伊战争即将来临，身为阿基琉斯的替代者，他又如何去改写历史，挽救自己的命运呢！希腊，这是一方迥异的世界，这里没有凡人晋升神明的可能，即便是拥有神之血脉的半神也不行。他这个华夏之民，又如何靠着自己的努力，改写这个万载不变的定律，成为第一个由半神成为真神的存在。QQ群：222192285,起点中文网,6.9,https://qidian.qpic.cn/qdbimg/349573/2241461/300,http://book.qidian.com/info/2241461
888,我有一个进化点,宝石猫,玄幻,88.8万字,完结,叮，您的镜子进化点+1，进化为魔镜;叮，您的鹅毛笔进化点+1，进化为命运之笔；叮，您的怀表进化点+1，进化为时间之钟……诸神复苏，神国再现，来到枪炮和钢铁世界的秦南，依靠着无限进化的能力，踏上了一段非凡之路！已完本精品作品《我有一张沾沾卡》、《无上崛起》、《随身英雄杀》，喜欢的兄弟可以看一下。,起点中文网,3.6,https://qidian.qpic.cn/qdbimg/349573/1019287873/300,https://m.qidian.com/book/1019287873/catalog
889,妖神,我丑到灵魂深处,玄幻,289.2万字,完结,诸天万界，唯我独尊……………………穿越异界，竟然成为一名被动挨打的活靶子，以为这一辈子就这么悲催的活下去哪成想偶得奇遇，成为怎么也打不死的不死小强靠着变态的独特能力，他终于成为无上至尊，一句“诸天万界，唯我独尊”响彻大地，谁敢不服？,起点中文网,3.9,https://qidian.qpic.cn/qdbimg/349573/3017381/300,https://m.qidian.com/book/3017381/catalog
890,我以妖格担保,公天下,玄幻,318.9万字,连载,开局一条蛇，进化全靠吃，迟早有一天，我要蜕变成无上真龙。无限流诸天万界——九州大陆，白蛇缘起，风语咒，狐妖小红娘，斗气大陆，宝莲灯，遮天，大主宰，完美世界，鸿蒙空间，混沌海。唯一读者群:703517301,起点中文网,3.9,https://qidian.qpic.cn/qdbimg/349573/1015249502/300,https://m.qidian.com/book/1015249502/catalog
891,我成了玄幻世界祖师爷,歌竟东方白,玄幻,54.3万字,完结,一觉醒来，姜晨已经带着祖师爷系统，穿越到了网游《天地》的世界当中！“你天资惊艳，被顶尖大派收为真传，想要主宰自己的命运，退婚对象却是天命之子，沦为他成道路上的笑柄？”“你是古老神灵转世，本该傲视天下人杰，家中一马奴却掠夺你的气运蓬勃而起，你最终只能成为他手下附庸？”“你千古才情第一，却惨遭迫害、孤苦一生，屠尽黑手终究无法救回自家兄长，只能在红尘中等他归来？”看着自己座下“艰难困苦”的弟子，姜晨不禁露出了一丝高深莫测的笑容。“莫慌，让为师来！”。ps：本书书友群寒鸦研究协会824592981，密码133，欢迎来玩~,起点中文网,4.1,https://qidian.qpic.cn/qdbimg/349573/1015938738/300,https://m.qidian.com/book/1015938738/catalog
892,嘲讽,奥比椰,玄幻,71万字,完结,林舟很惊讶地发现，只要有人嘲讽他，他的功力就开始增长。嘲讽的人越多，功力增长得就越快。哪怕十万八千里之外，不相干的人半夜三更里议论嘲讽他，他的功力都会增长。“听说了吗？林舟那废物居然自称武功天下第一，简直笑掉了我的大牙，哈哈哈哈……”“那个林舟啊，居然说云沙第一美男陆公子没他帅，有这么不知廉耻的人么？”“……”“……”这大半夜里睡着觉突然又升级了，谁在嘲讽本少爷？,起点中文网,5.4,https://qidian.qpic.cn/qdbimg/349573/3151208/300,http://book.qidian.com/info/3151208
893,造化图,横扫天涯,玄幻,87.4万字,完结,【白金新书】有间歇性强迫症的学渣沈哲，穿越到一个到处都是学霸的世界。脑中多出一本可以改变规则，制定真理的造化图，于是他牛了。“熟能生巧，是将武技和修炼者一起煮熟，后者就和武技熟悉了，轻松学会其中的武功！”“断章取义，是指断章的作者，会被读者邮寄刀片，砍下手脚，换上义肢！”“绝对值呢？当然是绝对颜值了，带在身上轻松变成天下第一帅！”“斗气化马，只要和别人斗气，怒气值越高，化出来的马就越强，跑的越快，所以斗帝的马，追不上斗者，因为他们喜怒不形于色。”改定义，定真理，以学渣的眼光定义学霸世界。且看一个学渣，如何逆袭，成为全科学霸的故事。全新玄幻世界，全新世界架构，欢迎入坑。ps：已完本《天道图书馆》、《无尽丹田》、《拳皇异界纵横》等书，质量保证，放心阅读。,起点中文网,2.5,https://qidian.qpic.cn/qdbimg/349573/1016597088/300,http://book.qidian.com/info/1016597088
894,西游签到五十年，开局斩猴王,老鹰吃乌贼,玄幻,31.6万字,连载,沈缘一觉醒来，发现自己变成了天庭斩妖台内的普通天将。脑海中莫名多出一个万妖殿，其内放置着天下众妖的雕像，只要对妖物造成伤害，对应的雕像就会亮起，自己也会获得妖物的能力。那还有什么好说的，斩妖台签到走起！沈缘接过同伴手里的刀，大步朝着前方走去。在众人的怜悯注视下，他看见了被五花大绑在地上的一只猴妖……手起刀落！一道清脆的金属碰撞声响彻天地！【恭喜宿主获得法天象地！】【恭喜宿主获得铜头铁臂！】【恭喜宿主获得大品天仙决！】沈缘看了看地上被自己斩断的一根猴毛，又看了着那只怒视着自己的猴子，逐渐陷入沉思…………我是妖中王，亦能称仙帝，若是爷愿意，灵山也可去！,起点中文网,5.6,https://qidian.qpic.cn/qdbimg/349573/1025992325/300,https://m.qidian.com/book/1025992325/catalog
895,镇武司,沈不更,玄幻,29.8万字,连载,神武十年冬，有飞剑破空而来，斩丞相辛圭于皇城外。帝震怒，下诏重建镇武司。镇武司掌镇武扳指，使神通“引梦拘魂术”，专管神通犯罪之事，镇压神通者。书友群：587465362,起点中文网,4.9,https://qidian.qpic.cn/qdbimg/349573/1016532718/300,http://book.qidian.com/info/1016532718
896,九阴九阳,娶猫的老鼠,玄幻,351万字,完结,杨风，因家族争权被追杀跳崖，没想到死而重生，并获得了先祖的传承，经脉被强大的内力改造，继续修炼古武绝学九阴九阳神功后，杨风决定逆天改命。一个本应生活在最底层的私生子，他将如何成为一代天神，成就了一段传奇神话。,逐浪小说网,5.2,http://images.zhulang.com/book_cover/image/9/47/94735.jpg,http://www.zhulang.com/94735/index.html
897,超能战神,古剑锋,玄幻,363.2万字,连载,这里是绚烂多姿的银河星空，这里是变幻莫测的未来世界，这里是空前强大的人类文明，这里是异族纵横的宇宙时代。不同的文明在此汇聚与碰撞，不同的种族在此争斗。在这热血的时代，封印师罗阳重生，回到了高中时代，他仰望天地，环视诸界，在这个强者如林的星空下，凭借前世记忆，绝世功法，一步一步走上至强者的宝座。,创世中文网,5.4,http://wfqqreader.3g.qq.com/cover/901/450901/t5_450901.jpg,http://chuangshi.qq.com/bk/ly/450901.html
898,人在恶土无限复活,失灵笔,玄幻,28.4万字,连载,沈靖穿越到被咒能毁灭、充满怪物和觉醒者的末世。艰苦求生一年，难逃一死。然后他又活了。“原来我有无限复活能力吗？！”“咒能核心可是好东西，咸的甜的软的脆的都有，吃了还能升级。”“精神污染？肉体畸变？我不懂你们在说什么。”“生吞怪物，原地复活，清除污染，这不都是基操吗？”以无限复活能力，沈靖开始吞噬怪物、疯狂吸收各种咒术能力！死着死着，他就死成了恶土上最强猎手！,起点中文网,5.0,https://qidian.qpic.cn/qdbimg/349573/1025986669/300,http://book.qidian.com/info/1025986669
899,玄武战尊,天地有缺,玄幻,422.9万字,完结,末法时代桎梏在半步封神瓶颈的绝代魔头一次意外探险，重生回到百万年前的大争之世，修神诀，炼灵脉，成洞天，聚八荒，夺神位，成就古今最强创世神魔，无尽主宰…… 【本书自更新以来五百天，从无断更记录，更新稳定，放心阅读】 【我的神级手机助手连载二百五十天未断更，已完本】 【新书《我家后门通洪荒》求收藏求推荐票~】,创世中文网,5.3,http://wfqqreader.3g.qq.com/cover/548/13312548/t5_13312548.jpg,http://chuangshi.qq.com/bk/ly/13312548.html
900,我师父是林正英,一地金的信徒,玄幻,448.5万字,连载,【飞卢小说网独家签约小说：我师父是林正英】许岩穿越了，还得到了功德系统！！ 这，是一个妖魔鬼怪影视的世界位面，而他是九叔的徒弟。 天地灵气匮乏，妖魔横行，僵尸鬼怪肆虐，许岩带着自己的系统，一步步走上了天师之路。 飞卢小说网提醒您：本小说及人物纯属虚构，如有雷同，纯属巧合，切勿模仿。,飞卢小说网,5.2,http://img.faloo.com/Novel/498x705/0/288/000288714.jpg,http://b.faloo.com/f/531576.html
901,我开启了超凡游戏,上江君,玄幻,97.4万字,完结,重生后的张潼，怎么也没想到，自己随手扔了一个骰子，世界就变了。从深邃黑暗中走出的鬼怪，威能莫测的收容物，赋予人超凡力量的配方。面对这样的世界，张潼慌的一批。张潼：如何才能假装自己是个资深超凡？急，在线等！,起点中文网,3.9,https://qidian.qpic.cn/qdbimg/349573/1018368514/300,https://m.qidian.com/book/1018368514/catalog
902,我是小说里共同的大反派,大火力小铳,玄幻,108.2万字,完结,穿越到了众多小说组成的世界，成为了其中共同的大反派。不好意思，以前的反派没智商，但我有！！所有原著书中的角色，不过是我的提取逆命点的工具而已。我要让所有人知道，什么才是真正的大反派。新书《原来他们都是我徒弟》已经上传，还请大家多多支持！,起点中文网,3.6,https://qidian.qpic.cn/qdbimg/349573/1016913538/300,http://book.qidian.com/info/1016913538
903,龙舞九天,傲无常,玄幻,80.2万字,完结,（不废材，不天才，也没有大大的金手指，不乱拉仇恨，也不胡乱踩人。有的，只是一个正常的主角。致力于情节，人物，桥段，世界，恩怨情仇，跌宕起伏，意料之外，情理之中的一个故事。点进去看看，不合胃口可以点嚓嚓嚓嘛~走过路过，不要错过）有激情，有热血，有豪迈，有狂野，也有温柔。这是一本不同以往风格和味道的东方玄幻小说，希望让你在满是雷同的小说之中，找到一丝丝新意。发布个书友群：123292144,起点中文网,4.4,https://qidian.qpic.cn/qdbimg/349573/2520944/300,https://m.qidian.com/book/2520944/catalog
904,神级因果系统,盛夏流火,玄幻,175.6万字,完结,当穿越大学生关明玉获得这个神奇的因果系统后，龙蛇、奥术、诛仙……一个个世界，都留下了他的身影。“只要改变剧情就能获得因果点，然后用因果点兑换任何东西？””连这个都能兑换？”关明玉看着系统中的那柄天器，嘴里咬着半截面包，口齿不清的说到。“什么，小改怡情，大改伤身，强改灰飞烟灭？”“开什么玩笑，时机不到改变太大还有反噬？你早说啊……”话音未落，一道劫雷轰然劈下。关明玉，卒，死因：时机未到强行装逼，死于雷劈。,起点中文网,4.4,https://qidian.qpic.cn/qdbimg/349573/1009552869/300,http://book.qidian.com/info/1009552869
905,我画出了一个世界,秋风陌夏,玄幻,51.9万字,连载,我叫莫言，我是一个画家，直到某一天，我变成了造物主，上帝，万物起源，诸神之父......我所画的画，能变成实人，实景，实物......于是，一个恢弘壮阔的神魔世界，在我笔下慢慢成形......eg。本书灵气复苏流，幕后黑手流......,起点中文网,4.4,https://qidian.qpic.cn/qdbimg/349573/1017262213/300,http://book.qidian.com/info/1017262213
906,我把低武练成了仙武,真的不是许仙,玄幻,59.9万字,完结,唐杰穿越了，他很难受，因为穿越到仙侠世界的他不具有灵根，与仙道无缘。然而唐杰发现，自己在武道方面是无上奇才，越练越妖孽！于是唐杰走上了一条史无前例的仙武之路！极境童子功：修成一口先天童子气，吸收太阳精华，铸造先天童子金身！十三层龙象般若功：十三头古龙神象之力加身，手拿日月星辰！大日金钟罩：运功时如一轮大日，金刚不坏，光耀天地！唐杰表示：什么陆地神仙、仙道巨头，敢在我面前装逼都得死！本书又名：《氪金氪命走上巅峰》、《猛男就该干强者》、《明明都是练武，凭什么他这么炫酷》（本书书友群：1159181615）,起点中文网,4.5,https://qidian.qpic.cn/qdbimg/349573/1023516475/300,http://book.qidian.com/info/1023516475
907,签到仙武世界，打造气运神朝,白蘸糖,玄幻,39.8万字,连载,尘世之中，有列国争霸，诸侯逐鹿。九天之上，有仙神高踞，冷眼俯瞰。一觉醒来，赵穆成为周朝皇子。枯坐冷宫十二载，终于开启金手指。您来到了丹房，提取到了【血菩提】。您来到了藏书楼，提取到了【明神武典】。您来到了祭天高台，提取到了【天子望气术】。您来到了戎族古城，提取到了【圣魔四蚀】。昆仑之丘，归墟界海，阴世酆都……赵穆行过万界，将龙旗插遍诸天！,起点中文网,4.2,https://qidian.qpic.cn/qdbimg/349573/1025813882/300,http://book.qidian.com/info/1025813882
908,钢铁仙踪,流浪月光,玄幻,31.5万字,完结,这是一个21世纪的话唠军火贩子穿越到仙侠世界，打造一个属于他的修真帝国、商业帝国的故事。“其实我也没什么大的理想，只是希望世界和平，顺便解放全人类！如果命运一定要我统治这个时代，好吧，我勉为其难接受了！”这世界上只有两件东西称得上是男人的浪漫，一是波澜壮阔的战争，二是横跨星海的巨舰大炮！····························作者苦逼，早七晚十，写作不易，如果觉得好，请点下收藏，如果有建议，可以留言，谢谢大家。交流群：297895449（至今0书友，作者已经尴尬爆炸！）,起点中文网,4.6,https://qidian.qpic.cn/qdbimg/349573/1004085074/300,http://book.qidian.com/info/1004085074
909,虎君,当年离歌,玄幻,35.3万字,完结,我行我路，何惧尔等侧目。恩怨是非，岂须他人裁决？大丈夫行于世间，有敌当诛，有仇必血！当一切荣耀都烟消云散之际，少年布衣草履，以无上意志，踏天而行。,起点中文网,3.0,https://qidian.qpic.cn/qdbimg/349573/1013690521/300,http://book.qidian.com/info/1013690521
910,剑仙在此,乱世狂刀,玄幻,316.7万字,连载,表面上他是个剑仙。实际上……他是一个挂逼。公众号【乱世狂刀】。QQ群：189743494，所有读者皆可加！,纵横中文网,4.0,http://static.zongheng.com/upload/cover/67/9f/679f302ec13ef0c8323e529874133464.jpeg,http://book.zongheng.com/book/907701.html
911,高武27世纪,草鱼L,玄幻,413.4万字,完结,27世纪。人道昌盛，武道辉煌！养老院树荫下，胖老头用手里的核桃，弹崩了一场浩劫，他笑的像个弥勒佛。南街26号，有个小保安，他用奶茶弹出了冰魄奶针，地上多了一具奶茶味尸体，他一直想换个工作，可学历不高。年轻女孩的眼睛很亮，像八心八箭的水钻，她喜欢用头撞卡车，嘴里常说一句：下一辆。一些当兵的，在他们的墓碑上，刻着一句话：这几年，乱世如麻，苍生太苦，愿未来的你们，拥有锦绣年华！还有一些当兵的，也刻着一句话：如果未来天堂相见，请你告诉我：国泰民安，山河犹在！……深夜。苏越扛着十几袋水泥，蛙跳到山顶，他与孤独为伴。在神州流传着一句古话：天道酬勤。苏越坚信这句话。自强不息的神州人，贯彻酬勤之道，薪火相传，傲骨铮铮。……已经完本500万字小说，天天万更，人品保证！企鹅群：777376496,起点中文网,2.8,https://qidian.qpic.cn/qdbimg/349573/1014218975/300,http://book.qidian.com/info/1014218975
912,万古之王,快餐店,玄幻,387.9万字,完结,平民少年罗天，身怀绝世之资，却被误认为废脉者。偶得无上天书，开启至强神脉，修造化神诀，一飞冲天，震烁万古。 从世俗底层，到万界诸天，横压当世天骄，纵横万千宗门，睥睨神话万族，成就不朽不灭永恒超脱的万古至尊之王！ ①本书是天才流，非废材流 ②已完本《主宰之王》、《仙鸿路》等作品，品质有保证。,创世中文网,4.4,http://wfqqreader.3g.qq.com/cover/678/21092678/t5_21092678.jpg,http://chuangshi.qq.com/bk/ly/21092678.html
